BANK,IFSC,MICR,BRANCH,ADDRESS,CONTACT,CITY,DISTRICT,STATE,ABBREVIATION
HDFC Bank,HDFC0CYMSB1,445814002,The Yavatmal Mahila Sah Bank Ltd,"Annapurna, Mainde Chowk, Sankat Mochan Road Yavatmal",250661.0,Yavatmal,Yavatmal,Maharashtra,HDFC
HDFC Bank,HDFC0CYACBP,415814352,The Yashwant Co-Op Bank Ltd Phaltan,"69, Guruwar Peth, Chawdi Chowk, Karad - 415110",9422745818.0,Karad,Satara,Maharashtra,HDFC
HDFC Bank,HDFC0CWUCBW,444814352,Warud Urban Coop Bank Ltd,Approach Road Warud,7229233472.0,Warud,Amravati,Maharashtra,HDFC
HDFC Bank,HDFC0CWUCB3,440802004,Wardhman Urban CO OP Bank Ltd,Godown No Building No Apmc Kalamna Market Nagpur,268118.0,Nagpur,Nagpur,Maharashtra,HDFC
HDFC Bank,HDFC0CWUCB1,,Wardhman Urban CO OP Bank Ltd,73 Sewasadansquare Central Avenue Nagpur,2725535.0,Nagpur,Nagpur,Maharashtra,HDFC
HDFC Bank,HDFC0CWOMEN,403451002,The Womens Coop Bank Ltd Panaji Goa,"Akash Bhavan, Ruaheliodoro DE Salgado Road Opp Mathais Plaza Panaji Goa - 403001",228933.0,Panaji,North Goa,Goa,HDFC
HDFC Bank,HDFC0CVVCCB,388810001,V.V.C.C Bank Ltd,"Shree Vallabh Chambers, Opp B&B Polytechnic College, Mota Bazar, Vallabh Vidhyanagar - 388120",237574.0,Vallabh Vidyanagar,Anand,Gujarat,HDFC
HDFC Bank,HDFC0CVVCAN,388810002,The Vallabh Vidyanagar Comm Coop Bank Ltd,N9 Business Centre 100 Feet Road Near Indira Statue Lambhvel Road Anand - 388001,238347.0,Anand,Anand,Gujarat,HDFC
HDFC Bank,HDFC0CVNB02,,Vaishya Nagari Sah Bank Ltd,"Sant Janabai Shopping Center, No 21 B, Aadalt Road, Gangakhed - 431514",9420079567.0,Parbhani,Parbhani,Maharashtra,HDFC
HDFC Bank,HDFC0CVMNSB,431880152,Vasundhara Mahila Ambajogai,Prashant Nagar Ambajogai,247928.0,Ambajogai,Ambajogai,Maharashtra,HDFC
HDFC Bank,HDFC0CVMCBA,362803051,The Veraval Mercantile Co-Op Bank,"Suvidha, Subhash Road, Veraval - 362265",6220209.0,Veraval,Junagadh,Gujarat,HDFC
HDFC Bank,HDFC0CVJSBL,400082420,Vasai Janata Sahkari Bank Ltd,"Mrudgandh Azad Road, Parnaka, Vasai (West) - 401201",9225104162.0,Thane,Thane,Maharashtra,HDFC
HDFC Bank,HDFC0CVIKAS,583805202,Vikas Souharda CO OP Bank Ltd,Station Road Hospet - 583201,226411.0,Hospet,Bellary,Karnataka,HDFC
HDFC Bank,HDFC0CVCB23,411109261,Shri Veershaiv Coop Bank Ltd. Kolh,"Agri.Produce Market Committee Gultekadi, Shri Ch.Shivaji Mkt.Gala.No 3, 1St Floor, Pune",24273688.0,Pune,Pune,Maharashtra,HDFC
HDFC Bank,HDFC0CVCB17,416407009,Shri Veershaiv Coop Bank Ltd. Kolh,"1-A/12&2 Anaji Complex, First Floor. Ward, Opp Kishor Co.Mahadwar Road, Kolhapur",2540608.0,Kolhapur,Kolhapur,Maharashtra,HDFC
HDFC Bank,HDFC0CVCB16,,Shri Veershaiv Coop Bank Ltd. Kolh,"724-A Khokale Bldg. Tanaji Chowk, Ganapati Peth Sangli - 416416",2324230.0,Sangli-Miraj-Kupwad,Sangli,Maharashtra,HDFC
HDFC Bank,HDFC0CVCB10,416407007,Shri Veershaiv Coop Bank Ltd. Kolh,"517A-1, Tararani Chowk, Kolhapur - 416001",2537329.0,Kolhapur,Kolhapur,Maharashtra,HDFC
HDFC Bank,HDFC0CVCABD,110208002,The Vaish CO OP Adarsh Bank Ltd,"3, Netaji Subhash Marg, Daryaganj, New Delhi. Pincode - 110000",9718991402.0,Delhi,Delhi,Delhi,HDFC
HDFC Bank,HDFC0CVB222,500222002,Vardhaman (Mahila)Coop Urban BK Ltd,"3-5-141/E/7, Ground Floor Geetanjali Complex, Eden Bagh, Ramkote, Hyderabad - 500001",23449461.0,Hyderabad,Hyderabad,Andhra Pradesh,HDFC
HDFC Bank,HDFC0CVB009,500222009,Vardhaman (Mahila)Coop Urban BK Ltd,"3-116, 1St Floor, Hanumannagar Colony Chaitanyapuri, Dilsukhnagar, Hyderabad - 500060",24050455.0,Hyderabad,Hyderabad,Andhra Pradesh,HDFC
HDFC Bank,HDFC0CVB008,500222008,Vardhaman (Mahila)Coop Urban BK Ltd,"Mahavir Hospital Premises, A.C.Gaurds, Hyderabad - 500004",23371865.0,Hyderabad,Hyderabad,Andhra Pradesh,HDFC
HDFC Bank,HDFC0CVB007,500222007,Vardhaman (Mahila)Coop Urban BK Ltd,"6-3-93, 1St Floor, Balanagar Road, Balanagar, Hyderabad - 500042",23776466.0,Hyderabad,Hyderabad,Andhra Pradesh,HDFC
HDFC Bank,HDFC0CVB006,500222006,Vardhaman (Mahila)Coop Urban BK Ltd,"PT No 7 7A, Mysari Chambers, Sarawathi Colony, Lothukunta Hyderabad - 500015",27864255.0,Hyderabad,Hyderabad,Andhra Pradesh,HDFC
HDFC Bank,HDFC0CVB005,500222005,Vardhaman (Mahila)Coop Urban BK Ltd,"7-1-81/1, 1St Floor Loya Arcade, Ameerpet, Hyderabad - 500016",23737513.0,Hyderabad,Hyderabad,Andhra Pradesh,HDFC
HDFC Bank,HDFC0CVB004,500222004,Vardhaman (Mahila)Coop Urban BK Ltd,"5-2-188, 1St Floor, Near Gowliguda Telehpone Exchange, Gowliguda Hyderabad-Pin-2 - 500001",24733381.0,Hyderabad,Hyderabad,Andhra Pradesh,HDFC
HDFC Bank,HDFC0CVB003,500222003,Vardhaman (Mahila)Coop Urban BK Ltd,"5-5-155&157, Lala Temple, Street, Ranigunj, Secunderabad - 500003",23449462.0,Hyderabad,Hyderabad,Andhra Pradesh,HDFC
HDFC Bank,HDFC0CVASM3,431848501,Vaijanath Appa Saraf Marat Nsbl,Magalwara Peth Basmath,220089.0,Basmath,Hingoli,Maharashtra,HDFC
HDFC Bank,HDFC0CVASM2,431848403,Vaijanath Appa Saraf Marat Nsbl,"Indira Nagar, Aundha, Hingoli",260111.0,Aundha Nagnath,Hingoli,Maharashtra,HDFC
HDFC Bank,HDFC0CVASM1,431848402,Vaijanath Appa Saraf Marat Nsbl,"Sadar Bazar, Hingoli",221396.0,Hingoli,Hingoli,Maharashtra,HDFC
HDFC Bank,HDFC0CVAMCO,,Vani Merchants Co-Op Bank Ltd,Paris Shivaji Road Vani Tal. Dindori Nasik,220140.0,Vani,Nasik,Maharashtra,HDFC
HDFC Bank,HDFC0CUUCB1,388808151,The Umreth Urban Cooperative Bank,Panchvati Umreth Anand District - 388220,276006.0,Umreth,Anand,Gujarat,HDFC
HDFC Bank,HDFC0CURBAN,577804152,The Urban Co-Operative Bank Ltd,"Old Santhe Maidana, Shikaripura - 577427",222264.0,Shikaripur,Shimoga,Karnataka,HDFC
HDFC Bank,HDFC0CUPCBA,362807111,The Una Peoples Co-Operative Bank,"Swastik, Opp School, B/H Dhruv Complex, Una - 362560",222527.0,Una,Junagadh,Gujarat,HDFC
HDFC Bank,HDFC0CUDYAM,411174306,Udyam Vikas Sahakari Bank Ltd Pune,"8/6, Erandwana, Behind Karve Road Telephone Exchange, Karve Road, Pune - 411004",25424320.0,Pune,Pune,Maharashtra,HDFC
HDFC Bank,HDFC0CUCUB9,504813202,Universal Coop Urban Bank Ltd,"Vysya Bank Road, Mancherial - 504208",7382030261.0,Mancheriyal,Adilabad,Andhra Pradesh,HDFC
HDFC Bank,HDFC0CUCBNR,380136002,The Union Co-Operative Bank Ltd,"Near Parvati Jadav Hospital, Naroda, Ahmedabad - 382330",22837500.0,Ahmedabad,Ahmadabad,Gujarat,HDFC
HDFC Bank,HDFC0CUAVNB,456537002,Ujjain Audhyogik Vikas Nagrik Sahak,Ksheer Sagar Hukumchand Kachhavya Marg Ujjain,2558639.0,Ujjain,Ujjain,Madhya Pradesh,HDFC
HDFC Bank,HDFC0CTZNBK,403639003,The Citizen Co-Op. Bank Ltd,"Lakshdeep Apartments, Near Damodar Temple, Vasco-Da-Gama - 403802",2512745.0,Panaji,North Goa,Goa,HDFC
HDFC Bank,HDFC0CTVCBL,380132005,The Vijay Co-Operative Bank Ltd,"Nobles, Opp Nehru Bridge, Ashram Road, Ahmedabad - 380009",26587688.0,Ahmedabad,Ahmadabad,Gujarat,HDFC
HDFC Bank,HDFC0CTUCOB,800028251,The Tapindu Urban Coop Bank Ltd,"Arunachal Bhawan, 1St Floor, New Dakbunglow, Patna - 800001",9304815025.0,Patna,Patna,Bihar,HDFC
HDFC Bank,HDFC0CTUB15,431065005,Tirupati Urban Co-Op Bank Ltd,Aurangabad,2235600.0,Aurangabad,Aurangabad,Maharashtra,HDFC
HDFC Bank,HDFC0CTUB13,400065251,Tirupati Urban Co-Op Bank Ltd,"Airoli, Mumbai",2235600.0,Thane,Thane,Maharashtra,HDFC
HDFC Bank,HDFC0CTUB06,440344006,Tirupati Urban Co-Op Bank Ltd,"Anant Nagar Road, Nagpur",2235600.0,Nagpur,Nagpur,Maharashtra,HDFC
HDFC Bank,HDFC0CTUB03,440344003,Tirupati Urban Co-Op Bank Ltd,"Gandhibagh, C.A. Raod, Nagpur",2235600.0,Nagpur,Nagpur,Maharashtra,HDFC
HDFC Bank,HDFC0CTUB02,440344002,Tirupati Urban Co-Op Bank Ltd,"S.A.Road, Nagpur",2235600.0,Nagpur,Nagpur,Maharashtra,HDFC
HDFC Bank,HDFC0CTTCBL,380131001,Textile Traders Co-Op. Bank Ltd,"6, Vsant Vihar Society, NR Mithakali Six Roads, Navrangpura, Ahmedabad - 380009",26430545.0,Ahmedabad,Ahmadabad,Gujarat,HDFC
HDFC Bank,HDFC0CTSMCB,422804201,The Sangamner Merch CO OP Bank Ltd,Indira Gandhi Marg New Nagar Road,9960936640.0,Sangamner,Ahmadnagar,Maharashtra,HDFC
HDFC Bank,HDFC0CTSCBL,380135002,The Sarangpur Co-Operative Bank Ltd,"First Dhal, Pritam Nagar, Ellisbridge, Ahmedabad - 380006",26579883.0,Ahmedabad,Ahmadabad,Gujarat,HDFC
HDFC Bank,HDFC0CTNNCB,380302003,The Naroda Nagrik Co-Op. Bank Ltd,"Naroda Bank Bhuvan, A-1/2, Dharamsut Coop Hsg Soc., Gurukul Rd., Memnagar, Ahmedabad - 380052",27483206.0,Ahmedabad,Ahmadabad,Gujarat,HDFC
HDFC Bank,HDFC0CTNCBL,380139009,The Navnirman Co-Operative Bank Ltd,"Navnirman Bank Bhavan, Shrimali Society, Rasala Marg, Navrangpura, Ahmedabad - 380009",26562637.0,Ahmedabad,Ahmadabad,Gujarat,HDFC
HDFC Bank,HDFC0CTMCNB,392802001,Mahila CO OP Nagarik Bank Ltd,"Khet Bhavan, Opp Unnati Apt., Sevashram Road, Bharuch",244430.0,Bharuch,Bharuch,Gujarat,HDFC
HDFC Bank,HDFC0CTMCBL,590802002,The Mahaveer Co-Op. Bank Ltd,"1157, Shree Renuka Towers, Anantshayan Galli, Belgaum - 590002",2407121.0,Belgaum,Belgaum,Karnataka,HDFC
HDFC Bank,HDFC0CTLCBL,413612003,The Laxmi CO OP Bank Ltd Solapur,269A Sakhar Peth Solapur,2747363.0,Solapur,Solapur,Maharashtra,HDFC
HDFC Bank,HDFC0CTGNSB,382810501,The Gozaria Nagarik Sahakari Bank,"Main Bazar, AT Post Office Gozariya, Mehsana, Gujarat - 382825",263346.0,Gojaria,Mahesana,Gujarat,HDFC
HDFC Bank,HDFC0CTGCUB,505846102,The Gayatri Co-Op Urban Bank Ltd,"7-1-72, 73, 74, Gayatri Towers, Tahasil Chowrasta, Jagtial",9885457766.0,Jagtial,Karimnagar,Andhra Pradesh,HDFC
HDFC Bank,HDFC0CTGB17,,The Gayatri CO OP Urban Bank Ltd,Main Road Nirmal Adilabad TS - 504106,7382226677.0,Nirmal,Adilabad,Telangana,HDFC
HDFC Bank,HDFC0CTGB15,505846005,The Gayatri CO OP Urban Bank Ltd,105 Mamidipally Road Armoor Nizamabad - 503224,7382226677.0,Armoor,Nizamabad,Telangana,HDFC
HDFC Bank,HDFC0CTGB07,,The Gayatri Co-Op Urban Bank Ltd,"#1-4-303, 1-4-303/1 Situated AT Gunj Road, Metpelly, Karimnagar. A.P - 505325",9246946677.0,Metpalle,Karimnagar,Andhra Pradesh,HDFC
HDFC Bank,HDFC0CTGB06,503846002,The Gayatri Co-Op Urban Bank Ltd,"7-2-60, Marwadi Galli, Near Goshala Complex, Nizamabad, Nizamabad. A.P - 503001",9248978111.0,Nizamabad,Nizamabad,Andhra Pradesh,HDFC
HDFC Bank,HDFC0CTGB05,504846202,The Gayatri Co-Op Urban Bank Ltd,"#5-495, 496, Gayatri Towers, Iqbal Ahmmad Ngr, New Mro Office-Opp Strt, Vill&Mdl:Mancherial:Adilabad.A.P",9248945222.0,Mancheriyal,Adilabad,Andhra Pradesh,HDFC
HDFC Bank,HDFC0CTGB04,505846002,The Gayatri Co-Op Urban Bank Ltd,"#7-4-412, First Floor, Near Geeta Bhavan Chowrasta, Mankamma Thota, Karimnagar Karimnagar.A.P - 505001",9246946677.0,Karimnagar,Karimnagar,Andhra Pradesh,HDFC
HDFC Bank,HDFC0CTGB03,,The Gayatri Co-Op Urban Bank Ltd,"H.No 9-8-54, First Floor, Ombedkar Chowrasta, Vill Mdl Vemulawada, Karimnagar - 505302",9299991667.0,Vemulawada,Karimnagar,Andhra Pradesh,HDFC
HDFC Bank,HDFC0CTGB02,,The Gayatri Co-Op Urban Bank Ltd,"No 1-2-301, 1St Flr, G.L.R. Complex Nizamabad RD Korutla Mdl Korutla Karimnagar, A.P - 505326",9299992217.0,Koratla,Karimnagar,Andhra Pradesh,HDFC
HDFC Bank,HDFC0CTGB01,,The Gayatri Co-Op Urban Bank Ltd,"House No 8-1-94/1, First Flr, R.R.D.Complex, Veenavanka Rd, Vill Mdl Jammikunta, Karimnagar - 505122",9393894599.0,Jammikunta,Karimnagar,Andhra Pradesh,HDFC
HDFC Bank,HDFC0CTCUBL,388811501,Tarapur Cooperative Urban Bank Ltd,Urban Bank Building Tarapur Anand Gujarat - 388180,255013.0,Tarapur,Anand,Gujarat,HDFC
HDFC Bank,HDFC0CTCHNB,385809501,The Chhapi Nagarik Sahakari Bank,"AT Post Office Chhapi, TA. Vadgam, Banaskantha, Gujarat",270488.0,Chhapi,Banas Kantha,Gujarat,HDFC
HDFC Bank,HDFC0CTBNSB,380421004,The Bavla Nagrik Sahakari Bank Ltd,"Bavla, Ahmedabad - 382220",232819.0,Bavla,Ahmadabad,Gujarat,HDFC
HDFC Bank,HDFC0CTBCBL,380134001,The Bhagyodaya CO. OP. Bank Ltd,"Nava Madhupura, NR Delhi Darwaja, Ahmedabad - 380004",9925121810.0,Ahmedabad,Ahmadabad,Gujarat,HDFC
HDFC Bank,HDFC0CTANSB,444894002,The Agrasen Nagari Sah Bank Ltd,"1St Floor Bhirad, Complex M.G. Road, Akola",2442131.0,Akola,Akola,Maharashtra,HDFC
HDFC Bank,HDFC0CSVSBL,380256002,Sardar Vallabhbhai Sahakari Bankltd,"Hariom Tower, Panchwati Road, Law Garden, Ahmedabad - 380006",26404576.0,Ahmedabad,Ahmadabad,Gujarat,HDFC
HDFC Bank,HDFC0CSVCBL,416407002,Shri Veershaiv Coop Bank Ltd. Kolh,"517, A/1, Tararani Chowk Kolhapur - 416001",2536940.0,Kolhapur,Kolhapur,Maharashtra,HDFC
HDFC Bank,HDFC0CSUDHA,560226276,Sri Sudha Co-Operative Bank Limited,"No 195/33, Sri Sudha Rajatha Bhavana, R.V.Road, Jayanagar, Bankgalore - 560004",26560195.0,Bangalore,Bangalore Urban,Karnataka,HDFC
HDFC Bank,HDFC0CSUCUB,508848202,Sudha Co.Op Urban Bank Ltd.Suryapet,"H.No 1-6-65, Near Vanijya Bhawan, Suryapet, Nalgonda (D.T)",222111.0,Suryapet,Nalgonda,Andhra Pradesh,HDFC
HDFC Bank,HDFC0CSTUCB,302426002,Sterling Urban Co-Op Bank Ltd,"O-11, 105 Shyam Anukampa, C-Scheme, Jaipur - 01",2370195.0,Jaipur,Jaipur,Rajasthan,HDFC
HDFC Bank,HDFC0CSSSSN,414852501,Shri Sawami Samarath Sah Bank Ltd,AP Nighoj Tal Parner Ahmednagar,9921336579.0,Nighoj,Ahmadnagar,Maharashtra,HDFC
HDFC Bank,HDFC0CSSSBN,560240252,Shushruti Souahrda Sahakra Bank,"#68, Shushruti Nagar, Andrahalli Main Road, Peenya 2nd Stage Bangalore - 560091",28362001.0,Peenya,Bangalore Urban,Karnataka,HDFC
HDFC Bank,HDFC0CSSMSB,591888402,Ssms Urbancoop Bank Ltd Athani,1212 Budhwar Peth Athani - 591304,252813.0,Athani,Belgaum,Karnataka,HDFC
HDFC Bank,HDFC0CSSCB1,423804001,Devyani Sahakari Bank Maryadit Kopargaon,Court Road Kopargaon - 423601,9881931462.0,Ahmadnagar,Ahmadnagar,Maharashtra,HDFC
HDFC Bank,HDFC0CSSBKN,577811002,Shiva Sahakari Bank Niyamita,"Administrative Office, Post Office Box No 48, Old Hospital Road, Davangere - 577001",2256107.0,Davangere,Davangere,Karnataka,HDFC
HDFC Bank,HDFC0CSSB09,440182011,Shikshak Sahakari Bank Ltd,C.A Road Nagpur,2722651.0,Nagpur,Nagpur,Maharashtra,HDFC
HDFC Bank,HDFC0CSPUCB,402806051,Shri Patneshwar Urb CO OP Bank Ltd,AT Sarswati Niwas Below Post Office Office Pen Near ST Stand Pen Raigad,2143254470.0,Pen,Raigad,Maharashtra,HDFC
HDFC Bank,HDFC0CSPCBL,383810501,The Sathamba Peoples CO Bank Ltd,"At&Post Office Sathamba, Ta:Bayad, Sabarkatha - 383340",284251.0,Sathamba,Sabar Kantha,Gujarat,HDFC
HDFC Bank,HDFC0CSNSBM,462310002,Sadguru Nagrik Sahakari Bank Mydt,"E-5/13, First Floor, Ravishankar Nagar, Arera Colony Bhopal - 16",4027400.0,Bhopal,Bhopal,Madhya Pradesh,HDFC
HDFC Bank,HDFC0CSNCBL,380215001,Saraspur Nagarik CO. OP. Bank Ltd,"1, Darshan Society, Stadium Commerce College Road, Navrangpura, Ahmedabad - 380009",26461630.0,Ahmedabad,Ahmadabad,Gujarat,HDFC
HDFC Bank,HDFC0CSMSSB,380124251,Shri Mahila Sewa Sahakari Bank Ltd,"109, Sakar 2, Opp Town Hall, Ellisbridge, Ahmedabad - 380006",26581597.0,Ahmedabad,Ahmadabad,Gujarat,HDFC
HDFC Bank,HDFC0CSMPBA,413916452,Shankarrao Mohite Patil Sah.Bank,"Sahakar Mandir, Mahavir Path, Akluj.Tal:-Malshiras, Solapur",9890790444.0,Akluj,Solapur,Maharashtra,HDFC
HDFC Bank,HDFC0CSLCBL,411465001,Shree Laxmi CO OP Bank Ltd Pune,"Parvati Industrial Estate, Pune Satara Road, Opp Adinath Society, Pune - 411009",24222699.0,Pune,Pune,Maharashtra,HDFC
HDFC Bank,HDFC0CSLABK,416583002,Subhadra Local Area Bank Ltd,"399, E, Opp Basant Bahar Talkies, Shahupuri, Kolhapur",652585.0,Kolhapur,Kolhapur,Maharashtra,HDFC
HDFC Bank,HDFC0CSID10,413802505,Siddheshwar Sahakari Bank Ltd Latur,Main Road Behind Gram Panchayat Karyalaya Andur Tuljapur Osmanabad - 413603,246633.0,Latur,Osmanabad,Maharashtra,HDFC
HDFC Bank,HDFC0CSID07,413802502,Siddheshwar Sahakari Bank Ltd Latur,Mirkale Complex MG Road Ahmedpur Latur - 413515,246433.0,Latur,Latur,Maharashtra,HDFC
HDFC Bank,HDFC0CSID06,413802501,Siddheshwar Sahakari Bank Ltd Latur,Mukteshwar High School1Shopping Complex Ausa Latur - 413520,220433.0,Latur,Latur,Maharashtra,HDFC
HDFC Bank,HDFC0CSHSBL,,"Sharad Sahakari Bank Ltd, Manchar","Market Yard-Manchar, Tal -Ambegaon, Pune - 410503",223603.0,Pune,Pune,Maharashtra,HDFC
HDFC Bank,HDFC0CSHNBL,385810501,Shihori Nagrik Sahakari Bank Ltd,"Near ST Stand, Shihori, TA Kankrej, Banaskantha - 385550",9427064914.0,Shihori,Banas Kantha,Gujarat,HDFC
HDFC Bank,HDFC0CSHIVA,577811152,Shiva Sahakari Bank Niyamita,"Vishvabandu Marulasidda Nilaya, Municipal Office Road, Shikaripura - 577427",223081.0,Shikaripur,Shimoga,Karnataka,HDFC
HDFC Bank,HDFC0CSGUCB,413917452,Sadguru Gahininath Sah Bank Ltd,"Bhagwan Mahaveer Path, Near Post Office Office A/P Akluj TQ Akluj Solapur",9422650950.0,Akluj,Solapur,Maharashtra,HDFC
HDFC Bank,HDFC0CSCOBL,380258002,Siddhi Co-Operative Bank Ltd,"Dhanlaxmi Cloth Market No1, Revdi Bazar, Kalupur, Ahmedabad - 380001",22165914.0,Ahmedabad,Ahmadabad,Gujarat,HDFC
HDFC Bank,HDFC0CSCBL2,380130002,The Social Coop Bank Ltd,"Shri Mahesh Jaswant Shah Bhavan, Next TO Khamasa Police Station, Khamasa, Ahmedabad - 380001",,Ahmadabad,Ahmadabad,Gujarat,HDFC
HDFC Bank,HDFC0CSCBL1,400068322,"The Sarvodaya Co-Op Bank Ltd, Mum","6, 7, Sheetal Apartment, S.P.S. Road, Bhandup (West), Mumbai - 400078",25953642.0,Mumbai,Greater Bombay,Maharashtra,HDFC
HDFC Bank,HDFC0CSCBHO,560226287,Suvarna Cooperative Bank Ltd,"62, Sanjeevappa Lane, Avenue Road Cross Bangalore - 560002",22110072.0,Bangalore,Bangalore Urban,Karnataka,HDFC
HDFC Bank,HDFC0CSCB29,700002251,The Shibpur Cooperative Bank Ltd,173 And 174 Shibpur Road Shibpur Howrah - 711102,990354766.0,Kolkata,Kolkata,West Bengal,HDFC
HDFC Bank,HDFC0CSBLIN,700099002,Sonali Bank Ltd,"14 Park Mansion, 57A Park Street, Kolkata - 700016",22293788.0,Kolkata,Kolkata,West Bengal,HDFC
HDFC Bank,HDFC0CSBL27,,Sadhana Sahakari Bank Ltd,Vashi Ware House Unit No 15 Plot No 2A Sector 19C Vashi Navi Mumbai - 400703,8888873573.0,Mumbai,Greater Bombay,Maharashtra,HDFC
HDFC Bank,HDFC0CSBL26,,Sadhana Sahakari Bank Ltd,Gat No 446 Shop No Matoshree Pride Alephata Tal Junnar Pune - 412411,8888873511.0,Pune,Pune,Maharashtra,HDFC
HDFC Bank,HDFC0CSBL19,411174602,Sadhana Sahakari Bank Ltd,SR No 202 5A 16 Sant Dnyaneshwar Nagar Shastri Chowk Bhosari Pune - 411039,8888873569.0,Pune,Pune,Maharashtra,HDFC
HDFC Bank,HDFC0CSBL10,411174426,Sadhana Sahakari Bank Ltd Hadapsar,"S.N.3A, Hissa No 11, Keshav Nagar Chowk, Mundhwa, Pune",26890429.0,Pune,Pune,Maharashtra,HDFC
HDFC Bank,HDFC0CSBL08,411174321,Sadhana Sahakari Bank Ltd Hadapsar,"581/6 A, G.S. Towers, Opp Pmt Bus Depo, Market Yard, Pune",24261330.0,Pune,Pune,Maharashtra,HDFC
HDFC Bank,HDFC0CSBL05,411174411,Sadhana Sahakari Bank Ltd Hadapsar,"SR. No 616/2, Aanand Plaza, 1St Floor, Shop No 14 15, Near Relience Petrol Pump, Purandar, Pune",225097.0,Pune,Pune,Maharashtra,HDFC
HDFC Bank,HDFC0CSBL04,411174315,Sadhana Sahakari Bank Ltd Hadapsar,"Ratan Villa, Opp of Anant Talkies, Ghorpadi Gaon, Pune - 411001",32532202.0,Pune,Pune,Maharashtra,HDFC
HDFC Bank,HDFC0CSBL03,411174316,Sadhana Sahakari Bank Ltd Hadapsar,"AT Post Office Loni Kalbhor, Tal-Haveli, Pune - 412201",26913300.0,Pune,Pune,Maharashtra,HDFC
HDFC Bank,HDFC0CSBL02,411174310,Sadhana Sahakari Bank Ltd Hadapsar,"S.N. 225/4, Shivam Complex, Aakashwani, Hadapsar, Pune - 411028",26990563.0,Pune,Pune,Maharashtra,HDFC
HDFC Bank,HDFC0CSBB15,411291015,Shivajirao Bhosale Sah Bank Ltd,No 34 Hissar No2 Flat No7 And Shivkrupa Cmpx Dattanagar Ambegaon Budruk Katraj Pune - 411046,9689989905.0,Pune,Pune,Maharashtra,HDFC
HDFC Bank,HDFC0CSBB13,411291013,Shivajirao Bhosale Sah Bank Ltd,No 311 Hissa No 15 A1 Anusaya Building Sasane Nagar Hadapsar Pune - 411028,9689989905.0,Pune,Pune,Maharashtra,HDFC
HDFC Bank,HDFC0CSBB12,411291012,Shivajirao Bhosale Sah Bank Ltd,"Suyash Plaza, Cts, No 796/15, Plot No 184A, Bhandarkar Road, Deccan Gymkhana, Pune - 4",25663349.0,Pune,Pune,Maharashtra,HDFC
HDFC Bank,HDFC0CSBB10,411291010,Shivajirao Bhosale Sah Bank Ltd,"AT Post Office Yawat, Tal-Dound, Pune - 412214",274084/85,Pune,Pune,Maharashtra,HDFC
HDFC Bank,HDFC0CSBB09,411291009,Shivajirao Bhosale Sah Bank Ltd,"Rutuja Apartment, Nda Road, Warje Malwadi, Pune - 411029",25237293.0,Pune,Pune,Maharashtra,HDFC
HDFC Bank,HDFC0CSBB07,411291007,Shivajirao Bhosale Sah Bank Ltd,"Shop No 9, Sector 4, Paranjape Scheme, New D.P.Road, Aundh, Pune - 7",9689896652.0,Pune,Pune,Maharashtra,HDFC
HDFC Bank,HDFC0CSBB06,411291006,Shivajirao Bhosale Sah Bank Ltd,"Sr.No 198, Anurag Complex, Pune-Alandi Road, Vishrantwadi, Pune - 15",9689989923.0,Pune,Pune,Maharashtra,HDFC
HDFC Bank,HDFC0CSBB04,411291004,Shivajirao Bhosale Sah Bank Ltd,"AT Post Office Lonikalbhor, Tal-Haveli Pune - 412201",26913264.0,Pune,Pune,Maharashtra,HDFC
HDFC Bank,HDFC0CSBB03,411291003,Shivajirao Bhosale Sah Bank Ltd,"AT Post Office Urulikanchan, Tal-Haveli Pune - 412202",26926214.0,Pune,Pune,Maharashtra,HDFC
HDFC Bank,HDFC0CSBB02,411291002,Shivajirao Bhosale Sah Bank Ltd,"26/1, Bharati Appartment, N.T Wadi, Shivajinagar, Pune - 5",25531110.0,Pune,Pune,Maharashtra,HDFC
HDFC Bank,HDFC0CSBB01,411291001,Shivajirao Bhosale Sah Bank Ltd,"94/A, Sangeeta Smruti, N.T.Wadi, Shivajinagar, Pune - 5",25536291.0,Pune,Pune,Maharashtra,HDFC
HDFC Bank,HDFC0CSAURA,380118273,The Saurashtra Cooperative Bank Ltd,"Bapunagar, Ahmedabad - 380024",22745288.0,Ahmedabad,Ahmadabad,Gujarat,HDFC
HDFC Bank,HDFC0CSANSB,442809102,Shri Anand Nagari Sah Bank Ltd,"Anand Sankul, Opp Azad Garden, Main Road, Chandrapur",257508.0,Chandrapur,Chandrapur,Maharashtra,HDFC
HDFC Bank,HDFC0CSANBK,444895002,Sanmitra Urban Co-Op Bank Ltd Akola,"Near Tilak Park, Ramdas Peth, Akola",2427346.0,Akola,Akola,Maharashtra,HDFC
HDFC Bank,HDFC0CSAMAT,700093253,Samata Cooperative Development Bank,"Karunamoyeecommunitycentre-Cum-Commercial Complex, Ed Blc, 1Flr, Salt Lakecity, Sectorii, Kolkata - 700091",23583882.0,Kolkata,Kolkata,West Bengal,HDFC
HDFC Bank,HDFC0CSACBL,416432201,"Shri Adinath CO OP Bank Ltd., Ichal","7/23, 24, Janata Chouk, Adath Peth, Ichalkaranji",2432904.0,Kolhapur,Kolhapur,Maharashtra,HDFC
HDFC Bank,HDFC0CRMUCB,302456251,Rajputana Mahila Urb Coop Bank Ltd,"Narayan Market, Anaj Mandi, Malpura Gate, Sanganer, Jaipur",2732978.0,Jaipur,Jaipur,Rajasthan,HDFC
HDFC Bank,HDFC0CRLUCB,284826002,Rani Laxmibai Urban Co.Op Bank,"77 Outside Khandarao Gate, Ashik Chauraha, Jhansi",9415587157.0,Jhansi,Jhansi,Uttar Pradesh,HDFC
HDFC Bank,HDFC0CRENUK,,Renuka Nagrik Sahakari Bank Mydt,Palace Road Ambikapur,9926175606.0,Ambikapur,Surguja,Chandigarh,HDFC
HDFC Bank,HDFC0CRATNA,415803051,Ratnagiri Cent CO OP Bank Ltd,"Sai Complex, Malnaka AT Post Office Tal Ratnagiri - 415612",220497.0,Ratnagiri,Ratnagiri,Maharashtra,HDFC
HDFC Bank,HDFC0CRAPCB,741859202,Ranaghat People'S Cooperative Bank,"1, Rabindra Sarani, Ranaghat - 741201",74335119.0,Kolkata,Kolkata,West Bengal,HDFC
HDFC Bank,HDFC0CRANUJ,384806501,The Ranuj Nagrik Sahakari Bank Ltd,"Station Road, Aminpura, AT Ranuj, Taluka Patan, Gujarat - 384275",325584.0,Ranuj,Patan,Gujarat,HDFC
HDFC Bank,HDFC0CPWD02,444885052,Abhinandan Urban Coop Bank Ltd,"Sadar Bazar, Main Road Paratwada",223910.0,Pathrot,Amravati,Maharashtra,HDFC
HDFC Bank,HDFC0CPUCBL,226185267,Progressive Urban Co.Op Bank,5/18 1St Floor Sector-K Aliganj Extension Lucknow - 226024,2745937.0,Lucknow,Lucknow,Uttar Pradesh,HDFC
HDFC Bank,HDFC0CPUBLP,415821352,The Patan Urban Coop Bank Ltd Patan,"886 'A', Main Road, Patan, Tal-Patan, Satara, Maharashtra - 415206",282921.0,Patan,Satara,Maharashtra,HDFC
HDFC Bank,HDFC0CPUB04,306701005,Pali Urban Co-Operative Bank Ltd,"Industrial Area, Pali",280623.0,Pali,Pali,Rajasthan,HDFC
HDFC Bank,HDFC0CPUB02,306701003,Pali Urban Co-Operative Bank Ltd,"Ghee KA Jhanda, Pali",222938.0,Pali,Pali,Rajasthan,HDFC
HDFC Bank,HDFC0CPSCBK,390202002,Pragati Sahakari Co-Operative Bank,"Alembic Road, Nizampura, Baroda",2281722.0,Vadodara,Vadodara,Gujarat,HDFC
HDFC Bank,HDFC0CPSBLN,,Pravara Sahakari Bank Ltd,"AT Post Office Loni Bk, Tal.Rahata",273516.0,Ahmadnagar,Ahmadnagar,Maharashtra,HDFC
HDFC Bank,HDFC0CPRMS2,133811002,The Postal Rms Employ Coop BK Ltd,"6070/10, 14 Idgag Road, Ambala Cantt - 133001",2600749.0,Ambala,Ambala,Haryana,HDFC
HDFC Bank,HDFC0CPRAGT,423813052,Pragati Urban CO OP Bank Ltd,Manke Compound Manmad Tal Nandgaon Nasik,224631.0,Manmad,Nasik,Maharashtra,HDFC
HDFC Bank,HDFC0CPNSBP,384815081,Patan Nagrik Sahakari Bank Ltd,"NR OM Complex, Main Bazal Road, Patan - 384265",226590.0,Ahmedabad,Ahmadabad,Gujarat,HDFC
HDFC Bank,HDFC0CPMCBL,380141002,Progressive Mercantile Co.Op. Bank,"Progressive Bank Bhavan, 670/1, Station Road, Ahmedabad - 380002",22134749.0,Ahmedabad,Ahmadabad,Gujarat,HDFC
HDFC Bank,HDFC0CPDUCB,,DR Panjabrao Deshmukh UR CO Bnk Ltd,Irvin Chowk Amravati,2663701.0,Amravati,Amravati,Maharashtra,HDFC
HDFC Bank,HDFC0CPDPBK,415832352,Adar P.D.Patil Sah Bank Ltd. Karad,"Sahakar Bhavan, Station Road, Karad, Satara - 415110",881655644.0,Karad,Satara,Maharashtra,HDFC
HDFC Bank,HDFC0CPDB18,,DR Panjabrao Deshmukh UR CO Bnk Ltd,Shaniwar Peth Anjangaon Surji - 444705,222581.0,Nandgaon Khandeshwar,Amravati,Maharashtra,HDFC
HDFC Bank,HDFC0CPDB17,,DR Panjabrao Deshmukh UR CO Bnk Ltd,Malgujaripura Wagare Chowk Near Wanjari Chowk - 442001,241237.0,Anjangaon Surji,Amravati,Maharashtra,HDFC
HDFC Bank,HDFC0CPDB16,,DR Panjabrao Deshmukh UR CO Bnk Ltd,Dastur Nagar Amravati - 444606,2576605.0,Amravati,Amravati,Maharashtra,HDFC
HDFC Bank,HDFC0CPDB15,444807352,DR Panjabrao Deshmukh UR CO Bnk Ltd,TQ Warud - 444906,233504.0,Warud,Amravati,Maharashtra,HDFC
HDFC Bank,HDFC0CPDB14,,DR Panjabrao Deshmukh UR CO Bnk Ltd,Sadar Bazar Paratwada TQ Achalpur - 444805,220047.0,Amravati,Amravati,Maharashtra,HDFC
HDFC Bank,HDFC0CPDB13,,DR Panjabrao Deshmukh UR CO Bnk Ltd,Navi Vasti Badnera Amravati - 444701,2681921.0,Amravati,Amravati,Maharashtra,HDFC
HDFC Bank,HDFC0CPDB12,,DR Panjabrao Deshmukh UR CO Bnk Ltd,Rukhmini Nagar Amravati - 444606,2673294.0,Amravati,Amravati,Maharashtra,HDFC
HDFC Bank,HDFC0CPDB11,,DR Panjabrao Deshmukh UR CO Bnk Ltd,Saurabh Colony Vmv Road Amravati - 444604,2531237.0,Amravati,Amravati,Maharashtra,HDFC
HDFC Bank,HDFC0CPDB10,,DR Panjabrao Deshmukh UR CO Bnk Ltd,Main Road Teosa - 444903,222108.0,Teosa,Amravati,Maharashtra,HDFC
HDFC Bank,HDFC0CPDB09,,DR Panjabrao Deshmukh UR CO Bnk Ltd,Sharad Nagar Ganesh Colony Amravati - 444605,2579953.0,Amravati,Amravati,Maharashtra,HDFC
HDFC Bank,HDFC0CPDB08,,DR Panjabrao Deshmukh UR CO Bnk Ltd,Nagar Parishad Complex Opp Nagar Parishad Chandur Rly TQ Chandur Rly - 444904,254088.0,Chandur,Amravati,Maharashtra,HDFC
