BANK,IFSC,MICR,BRANCH,ADDRESS,CONTACT,CITY,DISTRICT,STATE,ABBREVIATION
HDFC Bank,HDFC0004394,110240447,Sec Civ, Shop No Plot No GH 01 Ats One Hamlet Sector 104 Noida Gautam Budh Nagar Uttar Pradesh - 201301,9935903333.0,Noida,Gautam Buddha Nagar,Uttar Pradesh,HDFC
HDFC Bank,HDFC0004393,110240443,Sec Cxxxii Noida, 4003 And 4004 Express Trade Tower 36 Sector 132 Expressway Noida Gautam Budh Nagar Uttar Pradesh - 201301,9935903333.0,Noida,Gautam Buddha Nagar,Uttar Pradesh,HDFC
HDFC Bank,HDFC0004389,502240562,Jogipet, 68 Opp Market Committee Yard Jogipet Medak Andhra Pradesh - 502270,9949493333.0,Jogipet,Medak,Andhra Pradesh,HDFC
HDFC Bank,HDFC0004387,423240504,Nandgaon, Ground Floor of Hotel Amar Cts 2417 AT Post Office Nandgaon Nashik Maharashtra - 423106,61606161.0,Nandgaon,Nasik,Maharashtra,HDFC
HDFC Bank,HDFC0004380,509240642,Kalwakurthy, No 70 1A6 70 1B Opp Bus Depot Kalwakurthy Mahabubnangar Telangana - 509324,9949493333.0,Kalwakurti,Mahbubnagar,Telangana,HDFC
HDFC Bank,HDFC0004375,443240505,Nandura, Shri Ram Tower Adjacent TO Sbi NH Nandura Buldhana Maharashtra - 443404,61606161.0,Nandura,Buldhana,Maharashtra,HDFC
HDFC Bank,HDFC0004374,423240052,Manmad,Shop No E1 And E2 Ground Flour Shivaji Chawk Nashik Manmad Maharashtra - 423105,61606161.0,Manmad,Nasik,Maharashtra,HDFC
HDFC Bank,HDFC0004373,431240507,Kannad, Pishor Naka Pande Squre Kannad Kannad Maharashtra - 431103,61606161.0,Kannad,Aurangabad,Maharashtra,HDFC
HDFC Bank,HDFC0004372,126240053,Uchana Kalan,Aggarsain Chowk Near Anaj Mandi Uchana Kalan Jind Haryana Uchana Kalan Haryana - 126115,9996243333.0,Uchana,Jind,Haryana,HDFC
HDFC Bank,HDFC0004371,785240003,Jorhat AT Road, Jat Complex Road Jorhat Assam - 785001,9957193333.0,Jorhat,Jorhat,Assam,HDFC
HDFC Bank,HDFC0004370,520240104,Guntur Iiii, 14 221 Agrnd And 1St Floor Amaravati Road Opp Shivalayam Guntur Andhra Pradesh - 522007,9949493333.0,Guntur,Guntur,Andhra Pradesh,HDFC
HDFC Bank,HDFC0004369,700240106,Asyst Park Sector,Asyst Parkgn 37 Sector Salt Lake Bidhannagar Kolkata Kolkata West Bengal - 700091,9831073333.0,Kolkata,Kolkata,West Bengal,HDFC
HDFC Bank,HDFC0004368,797240003,Purana Bazar Dimapur, Opposite Axis Bank Purana Baza Dimapur Dimapur Nagaland - 797112,3453333.0,Dimapur,Dimapur,Nagaland,HDFC
HDFC Bank,HDFC0004366,362240003,Junagadh Gidc,NR Shreeji Auto And Suzuki Show Room Opp Sakaebaug Jetpur Road Junagadh Gujarat - 362002,9898271111.0,Junagadh,Junagadh,Gujarat,HDFC
HDFC Bank,HDFC0004355,282240506,Dayalbagh, Ground Floor 60 Ellora Enclave Dayalbagh Agra Uttar Pradesh - 282005,9935903333.0,Dayal Bagh,Agra,Uttar Pradesh,HDFC
HDFC Bank,HDFC0004352,495240508,Bilha,ward No3 Agrasen Chowk Bilha Bilaspur Chhattisgarh - 495224,9893603333.0,Bilha,Bilaspur,Chhattisgarh,HDFC
HDFC Bank,HDFC0004351,,Akaltara, Vyapar Parisar Shastri Chowk Akaltara Janigir Champa Akaltara Chhattisgarh - 495552,9893603333.0,Akaltara,Janjgir Champa,Chhattisgarh,HDFC
HDFC Bank,HDFC0004350,282240010,Belanganj, 184 Belanganj Agra Uttar Pradesh - 282006,9935903333.0,Agra,Agra,Uttar Pradesh,HDFC
HDFC Bank,HDFC0004344,781240016,Ganeshguri,Tower Manju Silk Centre Drrp Road Ganeshguri Guwahati Guwahati Assam - 781006,9957193333.0,Guwahati,Kamrup,Assam,HDFC
HDFC Bank,HDFC0004343,500240080,Kompally, 115 Karunas Arcade Survey No 94A Kompalle Rangareddi Telangana - 500055,9840673333.0,Hyderabad,Hyderabad,Telangana,HDFC
HDFC Bank,HDFC0004339,700240098,Paul Avenue, 90 Paul Avenue Kolkata Kolkata West Bengal - 700005,9831073333.0,Kolkata,Kolkata,West Bengal,HDFC
HDFC Bank,HDFC0004336,841240203,Maharajganj Bihar, DN Tubule And Store Purani Bazar Maharajganj Siwan Bihar - 841238,2666161.0,Maharajganj,Siwan,Bihar,HDFC
HDFC Bank,HDFC0004333,534240722,Akividu,73 Beside Sub Treasury Office Main Road Akividu Akividu Andhra Pradesh - 534235,9949493333.0,Akividu,West Godavari,Andhra Pradesh,HDFC
HDFC Bank,HDFC0004327,173240005,Kunihar Hat Kot, Vill Hat Kot Post Office Kunnihar Tehsil Arki Solan Himachal Pradesh - 173207,9996243333.0,Arki,Solan,Himachal Pradesh,HDFC
HDFC Bank,HDFC0004322,802240103,Arrah II, Maharaja Hata Road Opp Iocl Petrol Pump Pakri Road Bhojpur Bihar - 802301,2666161.0,Arrah,Bhojpur,Bihar,HDFC
HDFC Bank,HDFC0004317,177240005,Tira Sujanpur, Ward No II Adjoining Pnb Tira Sujanpur Hamirpur Hamirpur Himachal Pradesh - 176110,1800180433.0,Sujanpur Tira,Hamirpur,Himachal Pradesh,HDFC
HDFC Bank,HDFC0004313,791240003,Naharlagun, Basar Commercial Complex Naharlagun Naharlagun Arunachal Pradesh - 791110,3453333.0,Naharlagun,Papumpare,Arunachal Pradesh,HDFC
HDFC Bank,HDFC0004312,523240003,Vip Road Ongole, Door No 10 Ground Floor Vip Road Ongole Andhra Pradesh - 523001,9949493333.0,Ongole,Prakasam,Andhra Pradesh,HDFC
HDFC Bank,HDFC0004309,282240504,Khandauli,Ground Floor Mukandam Bhawan Opp Cold Storage Hathras Agra Main Road Khandauli Agra Uttar Pradesh - 283126,9935903333.0,Khandoli,Agra,Uttar Pradesh,HDFC
HDFC Bank,HDFC0004307,222240053,Barauli, Village Sarokhanpur Barauli Tehsil And Post Office Badlapur Jaunpur Uttar Pradesh - 222125,9935903333.0,Badlapur,Jaunpur,Uttar Pradesh,HDFC
HDFC Bank,HDFC0004305,495240101,Pamgarh,Main Road Near Alka Photo Studio Pamgarh Janjgir Champa Chhattisgarh Pamgarh Chhattisgarh - 497442,9893603333.0,Pamgarh,Janjgir Champa,Chhattisgarh,HDFC
HDFC Bank,HDFC0004300,524240542,Atmakur, Complex 1St Floor Municiple Bus Stop Atmakur Nellore Andhra Pradesh - 524322,9949493333.0,Atmakur,Nellore,Andhra Pradesh,HDFC
HDFC Bank,HDFC0004299,500240085,Suncity, No 58 G1 Raghuram Apartments Sun City Hydershahkotla Bandlaguda Rangareddi Telangana - 500068,9840673333.0,Hyderabad,Hyderabad,Telangana,HDFC
HDFC Bank,HDFC0004298,500240088,Champapet,champapet Main Road Green Park Colony Adjacent TO Sbh Hyderabad Telangana - 500059,9949493333.0,Hyderabad,Hyderabad,Telangana,HDFC
HDFC Bank,HDFC0004297,600240105,Adyar Gandhi Nagar, Grnd Flr Sreela Terrace No 105 First Main Road Gandhi Nagar Chennai Tamil Nadu - 600020,9840673333.0,Chennai,Chennai,Tamil Nadu,HDFC
HDFC Bank,HDFC0004295,414240006,Pipeline Road, Sgk Icon Pipeline Road Near Bharatgas Godaown Ahmednagar Maharashtra - 414003,61606161.0,Ahmadnagar,Ahmadnagar,Maharashtra,HDFC
HDFC Bank,HDFC0004294,230240502,Kunda, Padma Arogya Niketan Kunda Pratapgarh Uttar Pradesh - 230204,9935903333.0,Kunda,Pratapgarh,Uttar Pradesh,HDFC
HDFC Bank,HDFC0004291,500240079,Tarnaka, Hno12 13 11 And 1273 Tarnaka Rangareddi Hyderabad Telangana - 270127,9840673333.0,Tarnaka,Hyderabad,Telangana,HDFC
HDFC Bank,HDFC0004289,380240073,Kathwada,Shop No42 TO 45 Siddhivinayak Arcade SP Ring Road Odhav Kathwada Ahmedabad Gujarat - 382430,9898271111.0,Kathwada,Ahmadabad,Gujarat,HDFC
HDFC Bank,HDFC0004288,211240505,Soraon, Phulpur Road Beside Tehsil Office Soraon Allahabad Uttar Pradesh - 212502,9935903333.0,Soraon,Allahabad,Uttar Pradesh,HDFC
HDFC Bank,HDFC0004287,,Baskhari, Bank of Baroda Hamid Manzil Jalalpur Road Ambedkar Nagar Uttar Pradesh - 224129,9935903333.0,Baskhari,Ambedkar Nagar,Uttar Pradesh,HDFC
HDFC Bank,HDFC0004286,445240503,Pandharkawada, Gangotri Akhada Ward Pandharkawada Pandharkawada Maharashtra - 445302,61606161.0,Pandharkaoda,Yavatmal,Maharashtra,HDFC
HDFC Bank,HDFC0004285,680240034,Amballur,Upper Basement Floor Koovakadan Arcade NH Road Amballur Thrissur Kerala - 680301,9895663333.0,Amballur,Thrissur,Kerala,HDFC
HDFC Bank,HDFC0004284,524240302,Venkatagiri, Thriburani Heights 1St Flr Opp Thriburani Theaterer Main Road Venkatagiri Nellore Andhra Pradesh - 524132,9949493333.0,Venkatagiri,Nellore,Andhra Pradesh,HDFC
HDFC Bank,HDFC0004275,695240015,Pattoor, Ground Floor Amrit Plaza Nalumukku Junction Pattoor Thiruvananthapuram Kerala - 695001,9895663333.0,Thiruvananthapuram,Thiruvananthapuram,Kerala,HDFC
HDFC Bank,HDFC0004273,110240405,Ina Market, Shop No12 And 13 Lutyens Square Thyagraj Nagar Market Delhi Delhi - 110003,9996243333.0,Delhi,Delhi,Delhi,HDFC
HDFC Bank,HDFC0004271,271240054,Ikauna,Adjacent Sbi Ikauna Bypass Road Ikauna Bazar Shrawasti Uttar Pradesh Ikauna Uttar Pradesh - 271845,9935903333.0,Ikauna,Shravasti,Uttar Pradesh,HDFC
HDFC Bank,HDFC0004266,522240582,Kothapet Branch Guntur,Ground Floor Empire Kothapet Guntur Guntur Andhra Pradesh - 522001,9949493333.0,Guntur,Guntur,Andhra Pradesh,HDFC
HDFC Bank,HDFC0004264,641240023,Keeranatham, Chil Sez Area Keeranatham Village Keeranatham Main Road Coimbatore Tamil Nadu - 641035,9840673333.0,Coimbatore,Coimbatore,Tamil Nadu,HDFC
HDFC Bank,HDFC0004259,520240008,Currency Nagar Vijayawada,Door No 48 18 19B Ground Floor Mahanadu Road Currency Nagar Vijayawada Vijayawada Andhra Pradesh - 520008,9949493333.0,Vijayawada,Krishna,Andhra Pradesh,HDFC
HDFC Bank,HDFC0004257,621240002,Ariyalur, No 29B Mela Agraharam Ariyalur Ariyalur Tamil Nadu - 621704,9840673333.0,Ariyalur,Perambalur,Tamil Nadu,HDFC
HDFC Bank,HDFC0004255,342240007,Bilara,Chandrawat Bhawan Ajmer Road Bilara Rajasthan Bilara Rajasthan - 342602,9875003333.0,Bilara,Jodhpur,Rajasthan,HDFC
HDFC Bank,HDFC0004252,465240502,Agar,Ground Floor Shop No 21 Serial No 34 Chawni Naka Agar Agar Madhya Pradesh - 465441,9893603333.0,Agar Malwa,Shajapur,Madhya Pradesh,HDFC
HDFC Bank,HDFC0004251,560240121,Magadi Road, No27 27 Near Raheja Park Apartments Opp Sarvodaya Hospital Bangalore Karnataka - 560040,9945863333.0,Bangalore,Bangalore Urban,Karnataka,HDFC
HDFC Bank,HDFC0004249,456240003,Nikas Chouraha Ujjain, 31 Ankpat Marg Vishawas Chouraha Ujjain Madhya Pradesh - 456010,9893603333.0,Ujjain,Ujjain,Madhya Pradesh,HDFC
HDFC Bank,HDFC0004247,788240003,Hospital Road Avenue Silchar,n Avenue Silchar Silchar Assam - 788005,9957193333.0,Silchar,Cachar,Assam,HDFC
HDFC Bank,HDFC0004246,515240003,Ram Nagar Ananthapur, Plot No7 Lpno 592 83 Sno 61 Maruthi Nagar Ananthapur Andhra Pradesh - 515001,9949493333.0,Anantapur,Anantapur,Andhra Pradesh,HDFC
HDFC Bank,HDFC0004241,211240506,Handia, Ward No Handia Main Handia Crossing Allahabad Uttar Pradesh - 221503,9935903333.0,Handia,Allahabad,Uttar Pradesh,HDFC
HDFC Bank,HDFC0004239,229240052,Katra Lal Ganj, Katra Lal Ganj Gauriganj Amethi Amethi Uttar Pradesh - 227409,9935903333.0,Gauriganj,Sultanpur,Uttar Pradesh,HDFC
HDFC Bank,HDFC0004234,800240014,Ashiyana Nagar, Shipra Plaza Ashiyana Nagar Digha Road Opp Icici Bank Training Center Patna Bihar - 800025,2666161.0,Patna,Patna,Bihar,HDFC
HDFC Bank,HDFC0004231,500240090,Genome Valley,Synergy Sqare Alexandria Knowledge Park Genome Valley Turkapalle Hyderabad Telangana - 500078,9949493333.0,Hyderabad,Hyderabad,Telangana,HDFC
HDFC Bank,HDFC0004230,443240504,Dhad, Asha Complex Aurangabad Road Dhad Buldana Maharashtra - 443106,61606161.0,Dhad,Buldhana,Maharashtra,HDFC
HDFC Bank,HDFC0004229,760240004,Aska Road, Ground Floor Ward No Sarguna Street Aska Road Brahmapur Ganjam Odisha - 760006,9937903333.0,Brahmapur,Ganjam,Odisha,HDFC
HDFC Bank,HDFC0004227,380240074,Jalaram Mandir Paldi,Shop No Ground Floor Onyx Paldi Ahmedabad Ahmedabad Gujarat - 380007,9898271111.0,Ahmedabad,Ahmadabad,Gujarat,HDFC
HDFC Bank,HDFC0004224,440240020,Dattawadi,Shree Balaji Chember Plot No13B Khasara No 228 Amravati Road Wadi Nagpur Nagpur Maharashtra - 440023,61606161.0,Nagpur,Nagpur,Maharashtra,HDFC
HDFC Bank,HDFC0004220,560240137,Agara Junction Branch,FT Ring Road 22nd Main Agara Hsr Layout Sector Bangalore Bangalore Karnataka - 144150,9945863333.0,Bangalore,Bangalore Urban,Karnataka,HDFC
HDFC Bank,HDFC0004213,834240010,Kantatoli,Arunoday Tower 1St Floor Kantatoli Chowk Purlia Road Near Friends Petrol Pump Ranchi Jharkhand - 834001,2666161.0,Ranchi,Ranchi,Jharkhand,HDFC
HDFC Bank,HDFC0004212,242240054,Tilhar,Adjacent Baraoda Gramin Bank And Opposite of Obc Banwaripur Singh Coloney Tilhar Uttar Pradesh - 242307,9935903333.0,Tilhar,Shahjahanpur,Uttar Pradesh,HDFC
HDFC Bank,HDFC0004209,110240466,Devli Road Khanpur, 176A Devli Road Khanpur New Delhi Khanpur Delhi - 110062,9996243333.0,Delhi,Delhi,Delhi,HDFC
HDFC Bank,HDFC0004207,191240004,Charari Sharief,Main Chowk Gulshanabad Ward No Charari Sharief Budgam Charari Shariefjammu And Kashmir - 191112,1804333.0,Charari Sharif,Badgam,Jammu And Kashmir,HDFC
HDFC Bank,HDFC0004203,416240006,Vadgaon Kasba,Survey No 710 Nagar Palika Road AT Post Office Peth Vadgaon Peth Vadgaon Maharashtra - 416112,61606161.0,Peth Vadgaon,Kolhapur,Maharashtra,HDFC
HDFC Bank,HDFC0004202,414240004,Nagapur, Plot No Midc Nagapur Ahmednagar Maharashtra - 156157,61606161.0,Nagapur,Ahmadnagar,Maharashtra,HDFC
HDFC Bank,HDFC0004200,413240452,Akluj, Mahavir Path AT Post Office Akluj Tal Malshiras Solapur Maharashtra - 413101,61606161.0,Akluj,Solapur,Maharashtra,HDFC
HDFC Bank,HDFC0004198,560240147,Jigani, No320 P1 Jigani Industrial Area Jigani Bommasandra Link Road Bangalore Karnataka - 560105,9945863333.0,Jigani,Bangalore Urban,Karnataka,HDFC
HDFC Bank,HDFC0004191,110240423,Ashoka Park, Plot No 11 12 Ashoka Park Main Rohtak Road Delhi Delhi - 110034,9996243333.0,Delhi,Delhi,Delhi,HDFC
HDFC Bank,HDFC0004189,524240004,Vedayapalem, Valli Krishna Plaza Ground Floor Jyothi Nagar Vedayapalem Nellore Andhra Pradesh - 524004,9949493333.0,Nellore,Nellore,Andhra Pradesh,HDFC
HDFC Bank,HDFC0004188,530240010,Madhurawada Visakhapatnam, Door No 73 41 Gf1 Mukunda Enclave NR 100 Feetvuda RD Opp Shilparaman Vizag Visakhapatnam Andhra Pradesh - 530041,9949493333.0,Visakhapatnam,Vishakhapatnam,Andhra Pradesh,HDFC
HDFC Bank,HDFC0004187,411240056,Salunke Vihar, Girme Heights Plot No Bldg Asno 62 12 Salunke Vihar Road Pune Maharashtra - 411040,61606161.0,Pune,Pune,Maharashtra,HDFC
HDFC Bank,HDFC0004186,641240021,Thadagam Road Somayampalayam Branch,No 553 And 554 Thadagam Road Somayampalaym Coimbatore Coimbatore Tamilnadu - 641108,9840673333.0,Somayampalayam,Coimbatore,Tamil Nadu,HDFC
HDFC Bank,HDFC0004185,414240005,Shevgaon, Laxmi Nagar Near New Court Building Shevgaon Ahmednagar Maharashtra - 414502,61606161.0,Shevgaon,Ahmadnagar,Maharashtra,HDFC
HDFC Bank,HDFC0004184,171240013,Totu Cheli Chounla, Airport Road Totu Shimla Shimla Himachal Pradesh - 171011,1800180433.0,Simla,Simla,Himachal Pradesh,HDFC
HDFC Bank,HDFC0004177,110240394,Sector Xii Dwarka, Grnd Flr Plot No 28 Dwarka Sector 12A New Delhi Delhi - 110075,9996243333.0,Delhi,Delhi,Delhi,HDFC
HDFC Bank,HDFC0004174,520240622,Gannavaram, Old State Bank Road Srinagar Gannavaram Vijayawada Krishnaandhra Pradesh - 521101,9949493333.0,Gannavaram,Krishna,Andhra Pradesh,HDFC
HDFC Bank,HDFC0004173,500240075,Kphb Colony TH Phase, Plot No 52 And 53 1St Floor Kanaka Durga Mansion Hyderabad Telangana - 500072,9840673333.0,Hyderabad,Hyderabad,Telangana,HDFC
HDFC Bank,HDFC0004163,682240033,Seaport Airport Road Kakkanad, Ground Floor Chackacheril Tower Sea Port Airport Road Kakkanad Ernakulam Kerala - 680030,9895663333.0,Kakkanad,Ernakulam,Kerala,HDFC
HDFC Bank,HDFC0004162,781240017,Athgaon,Bawri Complex 132 Sati Joymati Road Athgaon Guwahati Guwahati Assam - 781001,9957193333.0,Guwahati,Kamrup,Assam,HDFC
HDFC Bank,HDFC0004161,423240153,Kalwan BK, Grd Flr Kothawade Building Survey10 1171 Deola RD Ganeshnagar AT Post Office Kalwan Nashik Maharashtra - 169117,61606161.0,Nashik,Nasik,Maharashtra,HDFC
HDFC Bank,HDFC0004159,518240003,Camp Center Kurnool, Dno 87 1139 Sai Durga Complex Nagi Reddy Revenue Colony Kurnool Andhra Pradesh - 518004,9949493333.0,Kurnool,Kurnool,Andhra Pradesh,HDFC
HDFC Bank,HDFC0004157,274240253,Barhaj, House No65 SA Nandana Ward War No18 Deoria Uttar Pradesh - 274601,9935903333.0,Barhaj,Deoria,Uttar Pradesh,HDFC
HDFC Bank,HDFC0004151,507240502,Madhira, Hno10 65 Grnd And First Floor Satyanarayana Complex Main Road Madhira Khammamtelangana - 507203,9949493333.0,Madhira,Khammam,Telangana,HDFC
HDFC Bank,HDFC0004150,301240026,Khairtal Mandi, Agrsen Circle Matore Road Khairtal Alwar Rajasthan - 301404,9875003333.0,Alwar,Alwar,Rajasthan,HDFC
HDFC Bank,HDFC0004148,133240019,Defence Colony Ambala Cantt, Sector Defence Colony Kalaheri Road Ambala Cantt Ambala Haryana - 133001,9996243333.0,Ambala Cantt,Ambala,Haryana,HDFC
HDFC Bank,HDFC0004142,641240022,Siddhapudur, TS No11 1370 1C2A10 Chinnasamy Road Siddhapudur Coimbatore Tamil Nadu - 641044,9840673333.0,Coimbatore,Coimbatore,Tamil Nadu,HDFC
HDFC Bank,HDFC0004139,110240388,Mayur Vihar Phase Second, Atm Star City Mall Plot No 01 Mayur Place DT Center New Delhi Delhi - 110091,9996243333.0,Delhi,Delhi,Delhi,HDFC
HDFC Bank,HDFC0004135,484240101,Anuppur,Ward No Opp Tehsil Office Jaithari Road Anuppur Anuppur Madhya Pradesh - 484224,9893603333.0,Anuppur,Anupur,Madhya Pradesh,HDFC
HDFC Bank,HDFC0004134,282240011,Trans Yamuna, F4 Trans Yamuna Colony Phase Agra Uttar Pradeshagra Uttar Pradesh - 282006,9935903333.0,Agra,Agra,Uttar Pradesh,HDFC
HDFC Bank,HDFC0004133,641240020,Ganapathy, No 117 And 117 Ground Floor Sathy Road Ganapathy Coimbatore Tamil Nadu - 641006,9840673333.0,Coimbatore,Coimbatore,Tamil Nadu,HDFC
HDFC Bank,HDFC0004132,560240117,Hoskerehalli, 3987 And 3988 Hosakerehalli Main Road 4th Phase Girinagar Bangalore Karnataka - 560085,9945863333.0,Bangalore,Bangalore Urban,Karnataka,HDFC
HDFC Bank,HDFC0004130,211240502,Naini, 10A Daud Nagar Mirzapur Road Naini Allahabad Allahabad Uttar Pradesh - 211008,9935903333.0,Allahabad,Allahabad,Uttar Pradesh,HDFC
HDFC Bank,HDFC0004129,274240203,Kaptanganj, Ward No House No18 Thana Kaptanganj Tehsil Hata NR Ajad Chowk Hata RD Kushi Nagar Uttar Pradesh - 274301,9935903333.0,Kaptanganj,Kushi Nagar,Uttar Pradesh,HDFC
HDFC Bank,HDFC0004126,123240054,Ateli, Old Bus Stand Ateli Mandi Narnaul Road Mahendergarh Mahendergarh Haryana - 123021,9996243333.0,Ateli,Mahendragarh,Haryana,HDFC
HDFC Bank,HDFC0004125,500240094,Abids, No5 211 First Floor Arcade Chirag Ali Lane Abids Hyderabad Telangana - 500001,9949493333.0,Hyderabad,Hyderabad,Telangana,HDFC
HDFC Bank,HDFC0004124,533240105,Ava Road Rajahmundry, No73 13 Plot No16 No 238 Srinivasa Nagar Extension Rajahmundry Andhra Pradesh - 533101,9949493333.0,Rajahmundry,East Godavari,Andhra Pradesh,HDFC
HDFC Bank,HDFC0004118,560240138,Singasandra,No 1066 Aecs Layout Block Singasandra Hosur Main Road Bangalore Bangalore Karnataka - 560068,9945863333.0,Bangalore,Bangalore Urban,Karnataka,HDFC
HDFC Bank,HDFC0004115,380240071,South Bopal,Shop No 25 26 Sobo Centre Sount Bopal Near SP Ring Road Bopal Ahmedabad Gujarat - 380056,9898271111.0,Bhopal,Bhopal,Gujarat,HDFC
HDFC Bank,HDFC0004107,110240417,Alipur, Khasra No Main Narela Roadnew Delhi Delhi - 100101,9996243333.0,Delhi,Delhi,Delhi,HDFC
HDFC Bank,HDFC0004106,530240008,Akkayapalem Visakhapatnam, Dno3 73 Hig Midhilapuri Vuda Colony 100 Feet Road Madhurawada Visakhapatnam Andhra Pradesh - 530041,9949493333.0,Visakhapatnam,Vishakhapatnam,Andhra Pradesh,HDFC
HDFC Bank,HDFC0004099,425240505,Akkalkuwa,Opposite TO State Bank Ltd Main Road Akkalkuwa Akkalkuwa Maharashtra - 425415,61606161.0,Akkalkuwa,Nandurbar,Maharashtra,HDFC
HDFC Bank,HDFC0004098,132240356,Balla, Village Balla Vpo And Tehsil Balla Karnal Haryana - 132040,9996243333.0,Karnal,Karnal,Haryana,HDFC
HDFC Bank,HDFC0004095,500240084,Moula Ali, Navya Empire Ground Floor Hno 40 41 Moulali Main Road Hyderabad Telangana - 500040,9840673333.0,Hyderabad,Hyderabad,Telangana,HDFC
HDFC Bank,HDFC0004091,754240509,Kujang, AT Post Office Kujang Jagatsinghpur Jagatsinghpur Odisha - 754141,9937903333.0,Kujanj,Jagatsinghpur,Odisha,HDFC
HDFC Bank,HDFC0004088,518240622,Banaganapalle, 291 40 SY No15 Main Road Near Rtc Bus Stand 1A Ward No Kurnool Andhra Pradesh - 518124,9949493333.0,Banganapalle,Kurnool,Andhra Pradesh,HDFC
HDFC Bank,HDFC0004079,,Kaiserganj,Adjacent Allahabad Bank Kaiserganj Behraich Uttar Pradesh - 271903,9935903333.0,Kaisarganj,Bahraich,Uttar Pradesh,HDFC
HDFC Bank,HDFC0004075,560240150,Manyata Tech Park,Mfar Green Heart Phase IV Manyata Embassy Tech Park Hebbal Outer Ring RD Nagarvara Bangalore KA - 560045,9945863333.0,Bangalore,Bangalore Urban,Karnataka,HDFC
HDFC Bank,HDFC0004070,211240009,Jasra, IN Front of Post Office Office Beside Sbi Jasra Allahabad Uttar Pradesh - 212107,9935903333.0,Jasra,Allahabad,Uttar Pradesh,HDFC
HDFC Bank,HDFC0004069,206240252,Bidhuna, Bajaj Showroom Bela Road Nadi Tiraha Bidhuna Auriya Uttar Pradesh - 206243,9935903333.0,Bidhuna,Auraiya,Uttar Pradesh,HDFC
HDFC Bank,HDFC0004065,380240070,Adalaj,Shop No G9 G10 G11Amba Business Park NR Tri Mandir Shankul Ahmedabad Kalol Highway Gandhinagar Gujarat - 382421,9898271111.0,Gandhinagar,Gandhinagar,Gujarat,HDFC
HDFC Bank,HDFC0004063,695240013,Nalanchira, Vettakulam Arcade Near Mar Ivanious College Main Gate Thiruvananthapuram Kerala - 695015,9895663333.0,Nalanchira,Thiruvananthapuram,Kerala,HDFC
HDFC Bank,HDFC0004062,380240075,Kolat, Gulmohar Greens Golf Club Village Kolat Ahmedabad Gujarat - 382210,9898271111.0,Ahmedabad,Ahmadabad,Gujarat,HDFC
HDFC Bank,HDFC0004059,799240004,Sakuntala Road Agartala,Chopra Complex 106 Sakuntala Road Agartala Tripura Agartala Tripura - 799001,3453333.0,Agartala,West Tripura,Tripura,HDFC
HDFC Bank,HDFC0004058,786240003,Dibrugarh Chowkidinghee, Monalisa Hotel Mancotta Road Chowkidingee Dibrugarh Assam - 786001,9957193333.0,Chowkidinghee,Dibrugarh,Assam,HDFC
HDFC Bank,HDFC0004054,713240205,Durgapur Iii RD BR, A1 05 And A1 06 Sector 2A Bidhannagar Durgapur Burdwan West Bengal - 713212,9831073333.0,Durgapur,Barddhaman,West Bengal,HDFC
HDFC Bank,HDFC0004053,560240123,Arakere, No 84 4th Cross Panduranga Nagar Bannerghatta RD Near Corporation Bank Bangalore Karnataka - 560076,9945863333.0,Bangalore,Bangalore Urban,Karnataka,HDFC
HDFC Bank,HDFC0004050,110240433,Occus Quantum, Shop No 01 And 01 Ocus Quantum Sector 51 Gurgaon Haryana - 122002,9996243333.0,Gurgaon,Gurgaon,Haryana,HDFC
HDFC Bank,HDFC0004049,786240204,Tinsukia Rangagora Road, Rangagora Road Near Hanuman Mandir Tinsukia Assam - 786125,9957193333.0,Tinsukia,Tinsukia,Assam,HDFC
HDFC Bank,HDFC0004048,276240052,Lalganj Katghar,No 13 Ward No 11 Lalganj West Azamgarh UP Azamgarh Uttar Pradesh - 276202,9935903333.0,Lalganj,Azamgarh,Uttar Pradesh,HDFC
HDFC Bank,HDFC0004044,273240254,Anandnagar, Near Central Bank of India Main Road Anandnagar Maharajganj Uttar Pradesh - 273155,9935903333.0,Maharajganj,Maharajganj,Uttar Pradesh,HDFC
HDFC Bank,HDFC0004043,226240051,Ram Sanehi Ghat, Khasra No16 KA Prince Enterprises Village Bhitaria Majara Bani Kodar Barabanki Uttar Pradesh - 225409,9935903333.0,Bhiteria,Bara Banki,Uttar Pradesh,HDFC
HDFC Bank,HDFC0004042,451240051,Barwani,Plot North Avenue Plaza Anjad Road Barwani Madhya Pradesh - 451551,9893603333.0,Barwani,Barwani,Madhya Pradesh,HDFC
HDFC Bank,HDFC0004041,209240352,Tirwaganj, Madhu Roy Building Adjacent Pnb Main Road Tirwa State Tirwaganj Kannauj Uttar Pradesh - 209732,9935903333.0,Tirwaganj,Kanauj,Uttar Pradesh,HDFC
HDFC Bank,HDFC0004040,202240007,Dhanipur, Main Road Opp Police Station Dhanipur Aligarh Aligarh Uttar Pradesh - 202002,9935903333.0,Danipur,Aligarh,Uttar Pradesh,HDFC
HDFC Bank,HDFC0004026,110240465,Shivalik, Ground And Basement Floor 72 Shivalik New Delhi Delhi - 110017,9996243333.0,Delhi,Delhi,Delhi,HDFC
HDFC Bank,HDFC0004025,110240379,Azad Market, Ground And First Floor 6164 13 Main Bara Hindu Rao Azad Market Delhi Delhi - 110006,9996243333.0,Delhi,Delhi,Delhi,HDFC
HDFC Bank,HDFC0004024,400240190,Airoli II, Riddhi Heights Shop No3 Grd Flr Plot 59 Sector19 Airoli Navi Mumbai Thane Maharashtra - 400708,61606161.0,New Bombay,Thane,Maharashtra,HDFC
HDFC Bank,HDFC0004018,680240033,Wadakkanchery, Cornish Arcade Main Road Wadakkanchery Thrissur Kerala - 680582,9895663333.0,Wadakancherry,Thrissur,Kerala,HDFC
HDFC Bank,HDFC0004015,520240623,Bapulapadu Hanuman Junction,Shubha Krishna Enclave Opp Ioc Petrol Bunk Vijayawada Road Bapulapadu Hanuman Junction Andhra Pradesh - 521105,9949493333.0,Vijayawada,Krishna,Andhra Pradesh,HDFC
HDFC Bank,HDFC0004011,530240009,Seethammadara, No 50 96 Plot No175 Seethammadhara Opp Old Sbh Visakhapatnam Andhra Pradesh - 530013,9949493333.0,Visakhapatnam,Vishakhapatnam,Andhra Pradesh,HDFC
HDFC Bank,HDFC0004010,533240622,Ravulapalem, MB Complexnh Door No 1129 Beside Policestation Ravulapalem Post Office East Godavariandhra Pradesh - 533238,9949493333.0,Ravulapalem,East Godavari,Andhra Pradesh,HDFC
HDFC Bank,HDFC0004009,516240003,DC Road Cuddapah,No18 360 Ground Floor DC Road Near Machupalli Bus Stand Cuddapah Andhra Pradesh Cuddapah Andhra Pradesh - 516001,9949493333.0,Cuddapah,Cuddapah,Andhra Pradesh,HDFC
HDFC Bank,HDFC0004006,643240102,Coonoor, Shop No 34 And Sreeji Complex Bedford Circle Coonoor Tamil Nadu - 643101,9840673333.0,Coonoor,Nilgiris,Tamil Nadu,HDFC
HDFC Bank,HDFC0003996,,Pattan,Main Chowknear And Bank Pattan Baramulla Pattan Jammu And Kashmir - 193121,1804333.0,Pattan,Baramulla,Jammu And Kashmir,HDFC
HDFC Bank,HDFC0003994,110240380,Star Tower,Shop No 27 28 And 42 Star Mall Star Tower NH Sector 30 Gurgaon Haryana - 122001,9996243333.0,Gurgaon,Gurgaon,Haryana,HDFC
HDFC Bank,HDFC0003993,133240018,Ambala City Baldev Nagar, Khasra No75 Naraingarh Chowk Baldev Nagar Ambala City Haryana - 134007,9996243333.0,Ambala,Ambala,Haryana,HDFC
HDFC Bank,HDFC0003992,110240384,East Punjabi Bagh, Ground Floor East Avenue Road West Delhi Delhi - 110026,9996243333.0,Delhi,Delhi,Delhi,HDFC
HDFC Bank,HDFC0003991,530240007,Mvp Colony, Hig 88 Mvp Colony Vishakapatnam Andhra Pradesh - 530017,9949493333.0,Visakhapatnam,Vishakhapatnam,Andhra Pradesh,HDFC
HDFC Bank,HDFC0003988,133240017,Circular Road Ambala City, 18 Circular Road Timber Market Ambala City Haryana - 167116,9996243333.0,Ambala,Ambala,Haryana,HDFC
HDFC Bank,HDFC0003985,123240203,Asalwas, Delhi Jaipur Highway RD NR Bawal Indl Area Vill Asalwas Bawal Rewari Haryana - 123501,9996243333.0,Bawal,Rewari,Haryana,HDFC
HDFC Bank,HDFC0003983,626240202,Aruppukkottai,20 Trd Complex Srm Press Campus Thiruchuli Road Aruppukkottai Virudhunagar Tamil Nadu - 626101,9840673333.0,Virudhunagar,Virudhunagar,Tamil Nadu,HDFC
HDFC Bank,HDFC0003981,411240052,Aundh Nagras Road, Grnd Flr Nagras Tower Bldg Shop No No162 4A 5A DP Road Pune MH - 411007,61606161.0,Pune,Pune,Maharashtra,HDFC
