BANK,IFSC,MICR,BRANCH,ADDRESS,CONTACT,CITY,DISTRICT,STATE,ABBREVIATION
HDFC Bank,HDFC0002948,530240152,Narsipatnam," Ground Floor, 36-32, Ramaraopeta, Narsipatnam Visakhapatnam - 531116",9949493333.0,Narsipatnam,Vishakhapatnam,Andhra Pradesh,HDFC
HDFC Bank,HDFC0002947,505240602,Manthani," Survey No 91 92 Ground Floor, Erukalagudem, Beside Sbh Adb, Main RD, Manthani Karimnagar, Andhra Pradesh - 505184",9949493333.0,Manthani,Karimnagar,Andhra Pradesh,HDFC
HDFC Bank,HDFC0002945,192240005,Dooru Shahabad," Building Opposite TO Post Office Office Dooru Shahabad, Anantnag Jammu And Kashmir - 192211",8001804333.0,Anantnag,Anantnag,Jammu And Kashmir,HDFC
HDFC Bank,HDFC0002944,192240102,Tral,", A.Y Complex, Main Chowk, Tral, Pulwama Jammu And Kashmir - 192123",8001804333.0,Tral,Pulwama,Jammu And Kashmir,HDFC
HDFC Bank,HDFC0002942,781240012,Jagiroad," 1St Floor, Deka Complex, Jagiroad Dry Fish Market, P.S. Jagiroad, Morigaon Assam - 782410",9957193333.0,Jagiroad,Morigaon,Assam,HDFC
HDFC Bank,HDFC0002938,781240015,Sualkuchi," Ground Floor, Kolita Para, Near Nopara Bus Stand, Sualkuchi Assam - 781103",9957193333.0,Sualkuchi,Kamrup,Assam,HDFC
HDFC Bank,HDFC0002937,785240102,Golaghat," G.F. Road, Bengenkhawa, Golaghat - 785621",9957193333.0,Golaghat,Golaghat,Assam,HDFC
HDFC Bank,HDFC0002935,180240016,Satwari," Vyas Plaza, Satwari Chowk, Jammu Cantt., Jammu - 180003",8001804333.0,Jammu,Jammu,Jammu And Kashmir,HDFC
HDFC Bank,HDFC0002933,782240502,Kampur," P.O. And P.S. Kampur, Nagaon, Kampur Assam - 782426",9957193333.0,Kampur,Nagaon,Assam,HDFC
HDFC Bank,HDFC0002932,190240019,Hazratbal," Bota Bagh, Near Hatrik Restaurent, Hazratbal, Srinagar - 190006",8001804333.0,Telbal Hazratbal,Srinagar,Jammu And Kashmir,HDFC
HDFC Bank,HDFC0002930,781240014,"Beltoda, Guwahati"," 1St Floor, Beltola, Dispur-Basistha Road, Guwahati Assam - 781029",9957193333.0,Guwahati,Kamrup,Assam,HDFC
HDFC Bank,HDFC0002928,124240007,Sampla," Delhi By-Pass Chowk, Adjoining Hundai Showroom, Main Road, Bpo Sampla, Rohtak Haryana - 124501",9996243333.0,Sampla,Rohtak,Haryana,HDFC
HDFC Bank,HDFC0002926,491240501,Bemetra," Plt ON G.F And F.F AT H.No 1158-10 Near Old Bus Stand, Bemetara Durg Chhattisgarh - 491335",9893603333.0,Durg,Durg,Chandigarh,HDFC
HDFC Bank,HDFC0002922,125240004,Kalanwali," Plot No 4, Near Anaj Mandi, Kalanwali Haryana - 125201",9996243333.0,Kalanwali,Sirsa,Haryana,HDFC
HDFC Bank,HDFC0002917,143240306,Khadaur Sahib," Opp Bus Stand, Khadoor Sahib, Taran Taran Punjab - 143117",9815331111.0,Khadaur Sahib,Amritsar,Punjab,HDFC
HDFC Bank,HDFC0002916,781240011,Baruah Road," First Floor, Baruah Road, Guwahati Assam - 781024",9957193333.0,Guwahati,Kamrup,Assam,HDFC
HDFC Bank,HDFC0002915,135240009,Mustafabad," Khasra No 306/1/2, Opp Anajmandi Gate, Mustafabad, Yamunanagar Haryana - 133103",9996243333.0,Mustafabad,Yamunanagar,Haryana,HDFC
HDFC Bank,HDFC0002912,194240002,Kargil," Bagh-E-Khomeni, Kargil Ladakh, Kargil Jammu And Kashmir - 194103",8001804333.0,Kargil,Kargil,Jammu And Kashmir,HDFC
HDFC Bank,HDFC0002911,516240503,Kodur," 7-546-5, RS Road, Railway Kodur, Cuddapah Andhra Pradesh - 516101",9949493333.0,Kodur,Cuddapah,Andhra Pradesh,HDFC
HDFC Bank,HDFC0002909,143240018,Chabal Kalan," Amritsar Road, Chabal, Kalan The, Amritsar Punjab - 143301",9815331111.0,Amritsar,Amritsar,Punjab,HDFC
HDFC Bank,HDFC0002908,182240101,Doda," Main Bus Stand, Main Market, Nehru Comple X, Doda Jammu And Kashmir - 182202",8001804333.0,Doda,Doda,Jammu And Kashmir,HDFC
HDFC Bank,HDFC0002907,781240302,Rangia," Ground Floor, Ward No -5, R. D. Road, Rangia, Kamrup Assam - 781354",9957193333.0,Rangia,Kamrup,Assam,HDFC
HDFC Bank,HDFC0002906,176240003,Bharmour," Bharmour View Hotel And Restaurant Main Bazar, Bharmour Chamba Himachal Pradesh - 176315",8001804333.0,Chamba,Chamba,Himachal Pradesh,HDFC
HDFC Bank,HDFC0002904,193240001,Baramulla," Mint Business Centre Ground Floor, Baramullah Baramulla Jammu And Kashmir - 193101",8001804333.0,Baramulla,Baramulla,Jammu And Kashmir,HDFC
HDFC Bank,HDFC0002903,190240021,Brein," Khan Complex, Ground Floor Brein Nishat, Srinagar - 191121",8001804333.0,Srinagar,Srinagar,Jammu And Kashmir,HDFC
HDFC Bank,HDFC0002902,180240015,Channi Himmat," Shop No And 3, Sector 3, Channi Himmat, Jammu - 180015",8001804333.0,Chhani Himmat,Jammu,Jammu And Kashmir,HDFC
HDFC Bank,HDFC0002901,193240002,Magam," Main Bus Stop, Magam, Near Pasta Restaurant, Budgam Jammu And Kashmir - 193401",8001804333.0,Magam,Badgam,Jammu And Kashmir,HDFC
HDFC Bank,HDFC0002899,177240202,Amb," Khasra No 2231-33, Una Road, Near Petrol Pump Una Himachal Pradesh - 177203",8001804333.0,Una,Una,Himachal Pradesh,HDFC
HDFC Bank,HDFC0002897,781240013,Bijoynagar," Nh-37, Bijaynagar, Bijoynagar Assam - 781122",9957193333.0,Bijoynagar,Kamrup,Assam,HDFC
HDFC Bank,HDFC0002895,812240501,Sabour," Singh House, Sabour Bhag Alpur Road, Sabour, Bhagalpur Bihar - 813205",8602666161.0,Sabour,Bhagalpur,Bihar,HDFC
HDFC Bank,HDFC0002894,143240305,Naushehra Pannuan," Tarantaran Rd, Vpo Naushera Pannuan Near Police Line Tehsil, Taran Taran Punjab - 143409",9815331111.0,Naushehra Pannuan,Amritsar,Punjab,HDFC
HDFC Bank,HDFC0002893,142240006,Ajit Wal," Railway Road, Ajitwal, Moga Punjab - 142053",9815331111.0,Ajitwal,Moga,Punjab,HDFC
HDFC Bank,HDFC0002892,152240153,Arniwala Sheikh Subha," Dabwala Kalan Road, Arniwala, Ferozpur Punjab - 152124",9815331111.0,Arniwala Sheikh Subhana,Ferozpur,Punjab,HDFC
HDFC Bank,HDFC0002888,141240029,Sidwan Bet," Opp Axis Bank Atm, Jagraon Road, Sidwan Bet, Ludhiana Punjab - 142033",9815331111.0,Ludhiana,Ludhiana,Punjab,HDFC
HDFC Bank,HDFC0002887,143240017,Raja Sansi," Khasra No 85-2-5 V.P.O, Rajasansi, Ajnala Amritsar Road, Tehsil Ajnala Amritsar Punjab - 143101",9815331111.0,Raja Sansi,Amritsar,Punjab,HDFC
HDFC Bank,HDFC0002881,143240019,Attari," Near Bus Stand, Vpo Attari, Amritsar Punjab - 143108",9815331111.0,Attari,Amritsar,Punjab,HDFC
HDFC Bank,HDFC0002880,143240553,Chogawan," Kasra No .354-1 V.P.O. Chogawan, Teh Ajn Ala, Amritsar Punjab - 143109",9815331111.0,Chogawan,Amritsar,Punjab,HDFC
HDFC Bank,HDFC0002879,143240503,Rayya," Pheruman Road, Rayya, Amritsar, Amritsar Punjab - 143414",9815331111.0,Rayya,Amritsar,Punjab,HDFC
HDFC Bank,HDFC0002871,823240003,"Ota, Gaya"," Canteen Area, Officer'S Training Academy, Gaya Bihar - 823005",8602666161.0,Gaya,Gaya,Bihar,HDFC
HDFC Bank,HDFC0002870,560240086,Brooke Fields,"Plot No 2, New Cmc Plot No 21, Doddanekundi Industrial Area, No 13, Kiaddb, Brooke Field Bangalore Karnataka - 560048",9945863333.0,Bangalore,Bangalore,Karnataka,HDFC
HDFC Bank,HDFC0002865,422240503,Jawahar,"Ground Floor, Hotel Shyam Palace, Bus Stand Road, AT Post Office Taluka Jawahar, Thane Maharashtra - 401608",9890603333.0,Jawhar,Jawhar,Maharashtra,HDFC
HDFC Bank,HDFC0002864,400240169,Saphale,"Ground Floor, Shop No 3, 4, 5, And 6, Swastik Park, Safale-Pa Lgahr Road, Saphale, Taluka Palghar Thane Maharashtra - 401102",9890603333.0,Saphala,Thane,Maharashtra,HDFC
HDFC Bank,HDFC0002863,380240049,Ghuma,"Ground Floor, Ratnam Complex, Near Kabir Enclave, Bopal-Ghuma Road, Ahmedabad Gujarat - 380058",9898271111.0,Ahmedabad,Ahmedabad,Gujarat,HDFC
HDFC Bank,HDFC0002862,192240301,Kulgam," Mir Building, College Road, Kulgam Srinagar Jammu Kashmir - 192232",8001804333.0,Kulgam,Kulgam,Jammu And Kashmir,HDFC
HDFC Bank,HDFC0002861,226240019,Memora," Security Section, Air Force Station Memaura, P.O Banthra, Lucknow., Uttar Pradesh - 227001",9935903333.0,Banthra,Banthra,Uttar Pradesh,HDFC
HDFC Bank,HDFC0002860,400240168,"Clare Road, Byculla"," LA Vision Bldg., SH No 3, Grd. Flr, 85 Mir ZA Galib Mrg Clare Road, Nagpada Junction, Byculla Mumbai Maharashtra - 400008",9890603333.0,Mumbai,Greater Bombay,Maharashtra,HDFC
HDFC Bank,HDFC0002857,301240003,Matsya Industrial Area (Alwar)," Plot No BB 2, Adjoining Old Pnb Matsya Industrial Area Alwar Rajasthan - 301001",9875003333.0,Alwar,Alwar,Rajasthan,HDFC
HDFC Bank,HDFC0002853,110240311,"Qutub Plaza, Gurgaon"," 101, 101 A, First Floor, Qutab Plaza, Dlf-City, PH Ase-1, Gurgaon Haryana - 122002",9996243333.0,Gurgaon,Gurgaon,Haryana,HDFC
HDFC Bank,HDFC0002851,800240010,Rajendra Nagar," Sri Ram Enclave 15 A, Arya Kumar Road, Rajendra Nagar, Patna Bihar - 800016",8602666161.0,Patna,Patna,Bihar,HDFC
HDFC Bank,HDFC0002849,431240352,Parli," Chetan Agency, Laxmi Arket, Mondha, Near Idbi Bank, Parli, Bid Maharashtra - 431515",9890603333.0,Parli-Vaijnath,Parli-Vaijnath,Maharashtra,HDFC
HDFC Bank,HDFC0002848,768240501,Rengali,"Hdfc Bank Limited At-Ganesh Nagar P.O. Rengali, Sambalpur, Rengali Orissa - 768212",9937903333.0,Rengali,Sambalpur,Odisha,HDFC
HDFC Bank,HDFC0002847,396240133,Moti Daman,"Ground Floor, Nilkanth Appt, Near Football Ground, Moti Daman, Daman, Daman And Diu - 396220",9898271111.0,Daman,Daman,Daman And Diu,HDFC
HDFC Bank,HDFC0002843,431240007,"Cidco, Aurangabad"," Plot No Sector -E I, Town Centre, Cidco Aurangabad Maharashtra - 431001",9890603333.0,Aurangabad,Aurangabad,Maharashtra,HDFC
HDFC Bank,HDFC0002841,560240082,Vijaya Bank Layout,"90, Behind Ayyappa Temple, 6th Main, Vijaya Bank Layout, Bilekhalli, Off Bannergatta Road, Bangalore Karnataka - 560076",9945863333.0,Bangalore,Bangalore,Karnataka,HDFC
HDFC Bank,HDFC0002840,110240303,"Patparganj Indl Area, Delhi"," 120, Patparganj Industrial Area Delhi Delhi - 110091",61606161.0,Delhi,Delhi,Delhi,HDFC
HDFC Bank,HDFC0002838,302240018,"Bapu Nagar, Jaipur"," Shop No 1&2, Sun Tower S, SB 158-A, Bapu Nagar, Gandhi Nagar Mod Jaipur, Rajasthan",9875003333.0,Jaipur,Jaipur,Rajasthan,HDFC
HDFC Bank,HDFC0002837,302240017,"Ajmer Road, Jaipur"," Diamond Tower, 51 Neelk Anth Colony, Purani Chungi, Ajmer Road, Jaipur Rajasthan - 302021",9875003333.0,Jaipur,Jaipur,Rajasthan,HDFC
HDFC Bank,HDFC0002836,263240203,Rudrapur," Grnd Floor, Alankar Complex, Opp Ind Ane Gas Agcy Kashipur Byepass Road, Rudrapur Udham Singh Nagar Uttarakhand - 263153",9935903333.0,Rudrapur,Udham Singh Nagar,Uttarakhand,HDFC
HDFC Bank,HDFC0002833,833240002,Chaibasa Branch," Aikath Market Wing Amlatola, Chaibasa West Singhbhum Chaibasa Jharkhand - 833201",8602666161.0,Chaibasa,Paschimi Singhbhum,Jharkhand,HDFC
HDFC Bank,HDFC0002832,403240042,Nuvem,"H.No 31A1, 31A2, 31A3 Near Goa Ceramic House ON NH 17 Margao-Panaji Road, Belloi, Salcette Nuvem Goa - 403604",9890603333.0,Nuvem,South Goa,Goa,HDFC
HDFC Bank,HDFC0002831,786240502,Moran,"A.T. Road, Moranhat, Main Market, NR Aasam State Corp.Offic Dibrugar Moran Assam - 785670",9957193333.0,Moran,Dibrugarh,Assam,HDFC
HDFC Bank,HDFC0002830,110240310,Sec 93 Noida," Eldeco Studio Apartment S, Gautam Buddha Nagar Gautam Buddha Nagar Uttar Pradesh - 201301",9935903333.0,Noida,Gautam Buddha Nagar,Uttar Pradesh,HDFC
HDFC Bank,HDFC0002829,560240079,"Racecourse Road, Bangalore"," Grd. Floor, Ahuja Chambers No 1, KU Marapark RD, Opp Race Course, Banglore Urban Karnataka - 560001",9945863333.0,Bangalore,Bangalore Urban,Karnataka,HDFC
HDFC Bank,HDFC0002826,500240058,Mla Colony Banjara Hills," Door No 13-A-B-C, Mla Colo NY, Banjara Hills, Hyderabad Andhra Pradesh - 500034",9949493333.0,Hyderabad,Hyderabad,Andhra Pradesh,HDFC
HDFC Bank,HDFC0002825,520240103,"Gandhi Park, Guntur"," M/S Hindu College High School Cou 01St Floor, Opp Gandhi Park Guntur Andhra Pradesh - 522003",9949493333.0,Guntur,Guntur,Andhra Pradesh,HDFC
HDFC Bank,HDFC0002824,781240402,Pathshala,"Ward No Anchal Road Nxt TO United India Assurance Off Barpeta, Pathshala Assam - 781325",9957193333.0,Barpeta,Barpeta,Assam,HDFC
HDFC Bank,HDFC0002823,151240552,Bhucho Mandi," Adj. Obc, Ward No 3, Mandir Wali Gali, Bhucho Mandi, Bathinda Punjab - 151101",9815331111.0,Bathinda,Bathinda,Punjab,HDFC
HDFC Bank,HDFC0002822,400240164,"Sec-11, Kalamboli"," Shp No 6, 7, 9, Labh Avenue Chs Ltd., Se Ctor 11, Plot No 20=A, Kalamboli, Navi Mumbai Raigad Maharashtra - 410218",9890603333.0,Kalamboli,Raigad,Maharashtra,HDFC
HDFC Bank,HDFC0002816,180240014,Bishna," Near Police Station, Jammu Bishna Jammu And Kashmir - 181132",8001804333.0,Bishna,Jammu,Jammu And Kashmir,HDFC
HDFC Bank,HDFC0002813,530240006,Sri Surya Complex Gajuwaka," Sri Surya Complex, Door No 6-67-13, Nh-5, Opp Chinagantyada US Stop, Gajuwaka Andhra Pradesh - 530026",9949493333.0,Gajuwaka,Vishakhapatnam,Andhra Pradesh,HDFC
HDFC Bank,HDFC0002811,673240007,Civil Station Kozhikode," 1St Flr, Bldg No 611A R.S 50-5, Vengeri Vill., NR Civil Stn Wayanad Road, Calicut, Kozhikode Kerala - 673020",9895663333.0,Calicut,Kozhikode,Kerala,HDFC
HDFC Bank,HDFC0002806,226240018,Hewtte Lucknow," 102-25A, Old No 8, Hewette Road, Shivaji Marg, Lucknow Uttar Pradesh - 226001",9935903333.0,Lucknow,Lucknow,Uttar Pradesh,HDFC
HDFC Bank,HDFC0002803,413240151,Sargam Cinema Pandharpur,", Upper Grd Flr, 2nd Flr Golwalkar Complex, 4647 -2 A, Near Sargam Cinema, Pandharpur, Solapur Maharashtra - 413304",9890603333.0,Pandharpur,Solapur,Maharashtra,HDFC
HDFC Bank,HDFC0002801,182240501,Bhaderwah," Jani Bazaar, Baderwah, Doda Jammu And Kashmir - 182222",8001804333.0,Doda,Doda,Jammu And Kashmir,HDFC
HDFC Bank,HDFC0002800,185240001,Jawahar Nagar Rajouri," Ward No 6, Jawaharnagar, Near Children Park, Rajouri Jammu And Kashmir - 185132",8001804333.0,Rajouri,Rajouri,Jammu And Kashmir,HDFC
HDFC Bank,HDFC0002782,151240005,Grain Market Bathinda," Adjoining Grain Market, Bathinda Bathinda Punjab - 151005",9815331111.0,Bathinda,Bathinda,Punjab,HDFC
HDFC Bank,HDFC0002776,831240007,Kadma," Sarla'S Arcade, Govind Nagar, Opp KD Flats, Post Office And Pskadma, Jamshedpur Jharkhand - 831005",9996243333.0,Kadma,Bhiwani,Haryana,HDFC
HDFC Bank,HDFC0002775,180240010,Rehari Jammu," No 87 BC Road, Below Hot Billion, Rehari Chungi, Jammu Jammu And Kashmir - 180005",8001804333.0,Jammu,Jammu,Jammu And Kashmir,HDFC
HDFC Bank,HDFC0002770,600240093,Vanagaram," No 105-1B2 And 1B2A, Adayalampattu Village, Vanagram, Chennai, Thiruvallur Tamil Nadu - 600095",9840673333.0,Chennai,Chennai,Tamil Nadu,HDFC
HDFC Bank,HDFC0002769,141240026,Barewal Awana," Canal Road, Barewal Awana, Ludhiana Punjab - 141012",9815331111.0,Ludhiana,Ludhiana,Punjab,HDFC
HDFC Bank,HDFC0002763,147240103,Mandigobindgarh," Amloh Road, Near Punjab And Sindh Bank, Mandigobindgarh, Fatehgarh Sahib Punjab - 147301",9815331111.0,Gobind Garh,Fatehgarh Sahib,Punjab,HDFC
HDFC Bank,HDFC0002761,396240034,"Char Rasta, Vapi","Office No 1 2, 1St Floor, Above Dcb Bank Silvassa Road, Char Rasta, Vapi, Valsad Gujarat - 396195",9898271111.0,Vapi,Valsad,Gujarat,HDFC
HDFC Bank,HDFC0002759,143240016,Chheharta Amritsar," Khasra No 38, Sub Divis Ion No 2, GT Road, Nh-1, Chheharta, Amritsar Punjab - 143105",9815331111.0,Amritsar,Amritsar,Punjab,HDFC
HDFC Bank,HDFC0002758,180240009,Residency Road Jammu," Cosmo Hotel Building, Vir Marg, Residency Road, Jammu Jammu And Kashmir - 180001",8001804333.0,Jammu,Jammu,Jammu And Kashmir,HDFC
HDFC Bank,HDFC0002755,190240008,Qamarwari," Ground Floor, M.A. Complex, Qamarwari Srinagar, Srinagar, Jammu And Kashmir - 190010",8001804333.0,Srinagar,Srinagar,Jammu And Kashmir,HDFC
HDFC Bank,HDFC0002749,855240002,Kishanganj,"Amarlekha Complex, Hospital Road, Next TO Oriental Bank of Commerce Kishanganj Kishanganj Bihar - 855107",8602666161.0,Kishanganj,Kishanganj,Bihar,HDFC
HDFC Bank,HDFC0002747,733240503,Islampur,"1St Floor, Rajdarbar Complex, Road, Ukil Para Baz AR, Uttar Dinajpur Islampur West Bengal - 733202",9831073333.0,Islampur,Islampur,West Bengal,HDFC
HDFC Bank,HDFC0002743,180240011,"Narwal, Jammu"," Plot No 9, 1St Floor, Transport Nagar, Narwal, Jammu Jammu Kashmir - 180012",8001804333.0,Jammu,Jammu,Jammu And Kashmir,HDFC
HDFC Bank,HDFC0002742,403240032,Dabolim,"Alto Dabolim Business Centre, 146L, First Floor, Dabolim, South Goa Dabolim Goa - 403801",9890603333.0,Chicalim,South Goa,Goa,HDFC
HDFC Bank,HDFC0002741,403240031,Canca,"Demello Vaddo House No 392/A, Canca Parra Bardez (Taluk), North Goa Canca Goa - 403510",9890603333.0,Parra,North Goa,Goa,HDFC
HDFC Bank,HDFC0002737,403240038,Chandor,"Gwa Amchem Ghor, Unit No Villa Farmosa Road Near Chandor Church Chandor Goa - 403714",9890603333.0,Chandor,South Goa,Goa,HDFC
HDFC Bank,HDFC0002734,700240076,Lake Avenue," 13, Lake Avenue, Kolkata Kolkata West Bengal - 700026",9831073333.0,Kolkata,Kolkata,West Bengal,HDFC
HDFC Bank,HDFC0002731,444240102,"Shegaon Naka, Amravati"," Venus Plaza, Shegaon Naka, Amravati, Amravati Maharashtra - 444604",9890603333.0,Amravati,Amravati,Maharashtra,HDFC
HDFC Bank,HDFC0002730,591240302,Nipani," No 45/46, 1St Floor, Ashok Nagar, Next TO Syndicate Bank, Nippani, Belgaum Karnataka - 591237",9945863333.0,Belgaum,Belgaum,Karnataka,HDFC
HDFC Bank,HDFC0002729,560240075,"Domlur, Bangalore"," No 94, Amarjyothi Layout, Domulur, Irr, Bangalore, Banglore Urban Karnataka - 560071",9945863333.0,Bangalore,Bangalore Urban,Karnataka,HDFC
HDFC Bank,HDFC0002723,403240036,Saligao,"Shop No S-5 6, GR. Flr, Emilia Apt Tabrawaddo, Saligao, Bardez Saligao Goa - 403511",9890603333.0,Saligao,North Goa,Goa,HDFC
HDFC Bank,HDFC0002721,781240010,Kalapahar," Azad Road, Gopinath Nagar, Kalapahar Guwahati Assam - 781016",9957193333.0,99571 93333,Guwahati,Assam,HDFC
HDFC Bank,HDFC0002720,700240079,Entally Branch,"Hdfc Bank Limited 84, A.J.C Bose Road, Entally, Kolkata West Bengal - 700014",9831073333.0,Kolkata,Kolkata,West Bengal,HDFC
HDFC Bank,HDFC0002716,444240152,Akot," Durga Chambers, Bus Stand Road, Akot Akola Maharashtra - 444101",9890603333.0,Akot,Akola,Maharashtra,HDFC
HDFC Bank,HDFC0002712,475240051,Dabra," Subhash Ganj Main Road, Agrasen Chowk Dabra Gwalior Madhya Pradesh - 475110",9893603333.0,Gwalior,Gwalior,Madhya Pradesh,HDFC
HDFC Bank,HDFC0002711,682240030,Info Park Kochi," Athulya, Info Park, Kusumagiri P.O., Kakkanad Kochi Kerala - 682030",9895663333.0,Kochi,Ernakulam,Kerala,HDFC
HDFC Bank,HDFC0002709,560240078,"Chamarajpet, Bangalore","No 68, Appu Rao Main Road, 6th Main Road, Next TO Milan Jeweller S, Chamrajpet Banglore Urban Karnataka - 560018",9945863333.0,Bangalore,Bangalore Urban,Karnataka,HDFC
HDFC Bank,HDFC0002708,190240011,Munawarabadi Srinagar," MA Link Road, Munawarabad, Srinagar Jammu And Kashmir - 190001",8001804333.0,Srinagar,Srinagar,Jammu And Kashmir,HDFC
HDFC Bank,HDFC0002706,492240007,Jai Stambh Raipur," Above Bata Showroom, Opp Old Bus Std, NR Jai Stambha, Raipur Chattisgarh - 492001",9893603333.0,Raipur,Raipur,Chandigarh,HDFC
HDFC Bank,HDFC0002705,500240057,R.P.Road,5-3-372 1St Floor R.P.Road Secunderabad Andhra Pradesh - 500003,9949493333.0,Secunderabad Cantonment,Hyderabad,Andhra Pradesh,HDFC
HDFC Bank,HDFC0002704,520240302,Mangalagiri,"Ground Floor, Door No 1-437 Kothapeta GT Road Mangalagiri Mangalagiri - 522503",9949493333.0,Mangalagiri,Guntur,Andhra Pradesh,HDFC
HDFC Bank,HDFC0002703,517240003,"KT Road, Tirupati"," Towers, 1St Floor, 18-1-45 A, Santhi Nagar, KT Road, Tirupathi, Chittoor Andhra Pradesh - 517501",9949493333.0,Tirupati,Chittoor,Andhra Pradesh,HDFC
HDFC Bank,HDFC0002702,403240035,Anjuna,"Anjuna Anjuna No 1144 1, Mazal Waddo, Anjuna, Bardez Anjuna Goa - 403509",9890603333.0,Anjuna,North Goa,Goa,HDFC
HDFC Bank,HDFC0002696,250240202,Mawana,"No 228, Ground Floor, Dharamplace Mohalla Kabli Gate, CH Auhan Chowk Hastinapur Road, Mawana, Meerut Uttar Pradesh - 250401",9935903333.0,Mawana,Meerut,Uttar Pradesh,HDFC
HDFC Bank,HDFC0002695,143240256,"Amritsar Road, Batala","New Bijli Foundry Near Sales Tax Office Amritsar Road, Batala Gurdaspur Punjab - 143505",9815331111.0,Batala,Gurdaspur,Punjab,HDFC
HDFC Bank,HDFC0002692,415240353,Budhwar Peth-Karad," 123 B, Budhwar Peth, P.C. Corner Bldg., Shop No And 8-11, Opp Corporation Bank, Karad, Maharashtra - 415110",9890603333.0,Karad,Satara,Maharashtra,HDFC
HDFC Bank,HDFC0002690,411240042,Bawdhan Pune,"Ground Floor, Patil Palace, S.No -2-1, Nda-Pashan Road, Bavdh AN, Pune Maharashtra - 411021",9890603333.0,Pune,Pune,Maharashtra,HDFC
HDFC Bank,HDFC0002686,110240249,"Sushant Lok, Gurgaon"," Shop No 17-18 Ansal Peach Tree Sushant Lok-1, C Blo CK Gurgaon Haryana - 122002",9996243333.0,Gurgaon,Gurgaon,Haryana,HDFC
HDFC Bank,HDFC0002682,761240102,Parlakhemundi,"Aman Plaza, Market Square, Parlakhemundi, Gajapati, Orissa - 761200",9937903333.0,Parlakhemundi,Gajapati,Odisha,HDFC
HDFC Bank,HDFC0002681,431240502,Vaijapur,"Ground Floor, House No 550, Station Road, Vaijapur, Aurangabad, Maharashtra - 423701",9890603333.0,Aurangabad,Aurangabad,Maharashtra,HDFC
HDFC Bank,HDFC0002680,400240162,Uran,"Padma Manohar Apartment, Shop No TO 9, Pension Park, Kumbhar Wada Road, Uran Maharashtra - 400702",9890603333.0,Uran,Raigad,Maharashtra,HDFC
HDFC Bank,HDFC0002677,393240052,"Gidc, Anklesvar", 5701-A Gidc Ankleshwar Bharuch Gujarat - 393001,9898271111.0,Ankleshwar,Bharuch,Gujarat,HDFC
HDFC Bank,HDFC0002676,787240002,North Lakhimpur Branch,"Hdfc Bank Limited GB Market, IN Front of Daily Bazar, NT Road, Word No 13, North Lakhimpur Assam - 787001",9957193333.0,North Lakhimpur,Lakhimpur,Assam,HDFC
HDFC Bank,HDFC0002674,110240307,"Sec 48, Noida", Plot No A-182/2 Sector 48 Gautam Buddha Nagar Uttar Pradesh - 201301,9935903333.0,Noida,Gautam Buddha Nagar,Uttar Pradesh,HDFC
HDFC Bank,HDFC0002668,143240502,Dera Baba Jaimal Singh,"First Floor, Near Canara Bank, Dera Baba Jaimal Singh Beas, Amritsar, Punjab - 143204",9815331111.0,Amritsar,Amritsar,Punjab,HDFC
HDFC Bank,HDFC0002665,700240072,Khanna Branch,"Hdfc Bank Limited 229 -2 A.P.C. Road, Khanna Kolkata West Bengal - 700004",9831073333.0,Kolkata,Kolkata,West Bengal,HDFC
HDFC Bank,HDFC0002663,224240202,"Chajjapur, Tanda"," Municipal No 371 Mohalla Chajjapur East Ward No 2, Tanda Ambedkar Nagar Uttar Pradesh - 224190",9935903333.0,Tanda,Ambedkar Nagar,Uttar Pradesh,HDFC
HDFC Bank,HDFC0002662,276240102,Mubarak Pur," Municipal No 92-84 Mohala Nurpur Butat, Aziz Nagar, Mubarakpur, Azamgarh Uttar Pradesh - 276404",9935903333.0,Mubarakpur,Azamgarh,Uttar Pradesh,HDFC
HDFC Bank,HDFC0002661,332240025,Fatehpur," Chouhan Market, Sarawaton KA Mohalla, Fatehpur, Sikar, Rajasthan - 332301",9875003333.0,Sikar,Sikar,Rajasthan,HDFC
HDFC Bank,HDFC0002657,503240562,Bodhan,"1St Floor, 645 Ambedkar Roads Narsi Road Bodhan Andhra Pradesh - 503185",9949493333.0,Bodhan,Nizamabad,Andhra Pradesh,HDFC
HDFC Bank,HDFC0002656,210240002,Karwi Mafi," Pandey Complex, Khasra No 784, Village Karvi Mafi, Banda Allahabad Road, Tehsil Karwi, Chitrakoot Uttar Pradesh - 210205",9935903333.0,Karwi,Chitrakoot,Uttar Pradesh,HDFC
HDFC Bank,HDFC0002654,224240151,Jalalpur," Khasra No 899, Village Jalalpur Dehat, Pargana -Surhurpur, Tehsi L-Jalalpur Ambedkar Nagar Uttar Pradesh - 224149",9935903333.0,Jalalpur,Ambedkar Nagar,Uttar Pradesh,HDFC
HDFC Bank,HDFC0002650,210240152,Rath," House No 855, Mohalla Pathanpura, Ambedkar Crossi Hamirpur Road, Rath, Hamirpur Uttar Pradesh - 210431",9935903333.0,Hamirpur,Hamirpur,Uttar Pradesh,HDFC
HDFC Bank,HDFC0002648,203240051,Jahangirabad," Main Chowk, Anupshahr BY Pass, Jahangirabad Jahangirabad Uttar Pradesh - 202394",9935903333.0,Jahangirabad,Bulandshahr,Uttar Pradesh,HDFC
HDFC Bank,HDFC0002645,110240248,Unitech Cyber Park,"Shop No 005A 005B, Ground Floor, Tower A, Unitech Cyber Park, Sector 39, Gurgaon - 122001",9996243333.0,Gurgaon,Gurgaon,Haryana,HDFC
HDFC Bank,HDFC0002642,522240302,Bapatla,Door No 12-3-4B A.G.College Road Baptla Guntur Andhra Pradesh - 522101,9949493333.0,Bapatla,Guntur,Andhra Pradesh,HDFC
HDFC Bank,HDFC0002641,507240542,Palwancha," Ground Floor, 8-1-218, Natraj Centre, Paloncha, Khammam Andhra Pradesh - 507115",9949493333.0,Palwancha,Nizamabad,Andhra Pradesh,HDFC
HDFC Bank,HDFC0002635,212240202,Bindki," Khasra No 567 GA, Village Akbarpur Bahar, Lalouli Road, Bindki, Fatehpur Uttar Pradesh - 212635",9935903333.0,Bindki,Fatehpur,Uttar Pradesh,HDFC
HDFC Bank,HDFC0002634,610240003,Kuthanallur," No 62-A-117, Abdul Rehmen RD, Koothanallur Thiruvarur Tamil Nadu - 614101",9840673333.0,Tiruvarur,Thiruvarur,Tamil Nadu,HDFC
HDFC Bank,HDFC0002633,606240102,Kallakurichi,"74/1A, Vinayaga Towers, Salem Main Road, Opp TO Lvb, Kallakurichi Tamilnadu - 606202",9840673333.0,Kallakurichi,Villupuram,Tamil Nadu,HDFC
HDFC Bank,HDFC0002626,496240502,Kharsia," Agrasen Chowk, Main Road, Near Lic, Kharsiya, Raigarh Chattisgarh - 496661",9893603333.0,Raigarh,Raigarh,Chandigarh,HDFC
HDFC Bank,HDFC0002625,821240601,Mohania," Aghrorex Complex, Ramgarh Road, Mohania, Kaimur Bihar - 821109",8602666161.0,Mohania,Kaimur,Bihar,HDFC
HDFC Bank,HDFC0002624,210240202,Mahoba,"Grd. Floor, Hotel Krishna Residency Mohalla Gandhi Nagar, Ward Subash Nagar, Maho BA, Mahoba Uttar Pradesh - 210427",9935903333.0,Mahoba,Mahoba,Uttar Pradesh,HDFC
HDFC Bank,HDFC0002617,620240006,"KK Nagar, Trichy"," Sundaram Arcade No 14 B, Evr Salai, KK Nagar Trichy Tamil Nadu - 21",9840673333.0,Tiruchirappalli,Tiruchirappalli,Tamil Nadu,HDFC
HDFC Bank,HDFC0002610,804240002,Jehanabad," Arwal More, Gaya Patna Main Road, Jehanabad Bihar - 804408",8602666161.0,Jehanabad,Jehanabad,Bihar,HDFC
HDFC Bank,HDFC0002604,500240055,"Yousufguda, Hyderabad","Grd. Floor, H.No 8-3-231/W/62/G1, Womens Co-Op. Hsg. Society, Sreekrishna Ngr Crs Road, Yousufguda Hyderabad Andhra Pradesh - 500045",9949493333.0,Hyderabad,Hyderabad,Andhra Pradesh,HDFC
HDFC Bank,HDFC0002603,504240703,Bellampalli,Survey No 109 Plot No 506 28-3-100 Bellampalli Andhra Pradesh - 504251,9949493333.0,Bellampalli,Adilabad,Andhra Pradesh,HDFC
HDFC Bank,HDFC0002601,342240150,Phalodi," Nai Sarak, Behind Golcha Building, Adjoining Axis Bank, Phalodi, Jodhpur, Rajasthan - 342301",9875003333.0,Phalodi,Jodhpur,Rajasthan,HDFC
HDFC Bank,HDFC0002600,332240003,Neem KA Thana," Subhash Mandi, Shahpura Road, Neem KA Thana, Neem KA Thana Rajasthan - 332713",9875003333.0,Neem-Ka-Thana,Sikar,Rajasthan,HDFC
HDFC Bank,HDFC0002598,301240501,Tapokda," Khasra No 35, Opp Gramin Bank, Alwar BY Pass, Tapokda, Bhiwadi, Rajasthan - 301707",9875003333.0,Bhiwadi,Alwar,Rajasthan,HDFC
HDFC Bank,HDFC0002595,185240101,Poonch," Opp Sbi Bank, Bus Stand, Poonch Poonch Jammu Kashmir - 185101",8001804333.0,Poonch,Poonch,Jammu And Kashmir,HDFC
